Headline,Date
"Mahindra BE 6e, XEV 9e launch timeline revealed",2024-11-08
This tractor maker clocked its best-ever monthly sales in October,2024-11-07
Hyundai fends off Mahindra challenge in October as Tata beaten again,2024-11-01
"No festive cheer for Maruti as sales fall in October, compact segment hit hard, UV shines",2024-11-01
Mahindra records highest-ever SUV sales in October,2024-11-01
This Japanese 2W maker has achieved 50 lakh sales in Karnataka,2024-10-28
"Renault Nissan Automotive India reaches 4.5 million engine, gearbox production mark",2024-10-28
Mahindra opens 2 new facilities in Tamil Nadu for testing SUV safety and cell technology research,2024-10-24
Ola Electric introduces Ola Digital Twin platform integrated with NVIDIA Omniverse,2024-10-24
This OEM has bagged order for 500 e-buses from MTC Chennai,2024-10-24
"Uber Auto, Moto services to support economic activity of Rs 36,000 crore in 2024",2024-10-23
"Resolved 99.1% of complaints, says Ola Electric on consumer panel notice",2024-10-22
"This brand has won 1,000 bus chassis order from UPSRTC",2024-10-21
Ola clarifies on BOSS discounts,2024-10-17
Kia to launch 2 new affordable EVs by 2026,2024-10-17
This carmaker has made accessory from recycled GPGP plastic,2024-10-16
"Mahindra Arjun 605 DI 4WD tractor launched, aimed at North Indian markets",2024-10-15
Ratan Tata – A tribute to the man,2024-10-10
"Ratan Tata said: ""A promise is a promise""",2024-10-10
The BYD eMAX 7 electric MPV launched: Takes on the Toyota Innova Crysta,2024-10-08
Hyundai reaches 100 million vehicle production milestone globally,2024-09-30
Tata Motors conducts groundbreaking ceremony of new Tamil Nadu manufacturing unit,2024-09-28
"Anant Ambani, bp CEO inaugurate Jio-bp's 500th EV charging station at Jio World Centre",2024-09-27
This Indian firm to set up Rs 251 crore battery materials processing facility in USA,2024-09-26
BMW CE02 revealed: A quirky little electric city commuter,2024-09-25
This EV maker has partnered with Skyline Motors to deploy e-buses in Uttarakhand,2024-09-18
Mahindra looks to strengthen leadership position in LCV segment with new Veero,2024-09-18
"2024 Hyundai Alcazar first drive, review: More luxury, better value",2024-09-18
Ford to restart manufacturing in India for export markets,2024-09-13
"PM E-DRIVE, PM-eBus Sewa-PSM schemes to support 52,028 electric buses with Rs 7,826 crore outlay",2024-09-13
First Mahindra Thar Roxx to be auctioned for charitable cause,2024-09-12
"PM E-DRIVE scheme launched, Rs 10,900 crore outlay",2024-09-12
"This top tractor-maker has showcased first compressed biogas-powered model. Not Sonalika, TAFE, John Deere",2024-09-03
"No BMW, no Mercedes, billionaire Anand Mahindra drives this big, bold Mahindra SUV",2024-09-02
"Maruti, Hyundai, Tata, Mahindra, Kia, others to extend discounts under Vehicle Scrapping Policy",2024-08-29
"This company incentivises new truck, bus purchases under Vehicle Scrappage Policy. Not Tata, Mahindra",2024-08-29
"This Japanese carmaker has inaugurated 500th premium outlet in India. Not Toyota, Honda, Nissan",2024-08-23
"This carmaker adds 7 new dealerships in Kerala. Not Mahindra, Honda, Toyota, MG",2024-08-21
"This top carmaker to set up hydrogen innovation centre in Tamil Nadu. Not Maruti, Tata, Mahindra, Kia",2024-08-21
"This CV maker has inaugurated new mechatronics lab. Not Tata, not Mahindra, not even Ashok Leyland",2024-08-19
Have you downloaded the latest issue of AUTO TODAY magazine yet?,2024-08-12
"Cars24 expands app-based services, introduces 'Orbit' car management system",2024-08-12
Range Rover Sport SV Edition Two debuts. Check details here,2024-08-08
"Bajaj Chetak 3201 special edition launched exclusively on Amazon, priced at Rs 1,28,744",2024-08-06
This Made-in-India Japanese scooter is gaining popularity in Europe,2024-08-05
"Robust demand continues for Mahindra SUVs. Scorpio, XUV 3XO, XUV700 major drivers",2024-07-31
Yezdi Adventure gets an upgrade. Prices have dropped too,2024-07-31
"2,700,000 units sold in 9 years, meet India's fastest-growing auto retail channel. Not Tata, Mahindra, Kia",2024-07-30
"This carmaker partners with Charge Zone to install high speed chargers at dealerships, Not Tata, Mahindra, MG",2024-07-24
"This tractor maker has reached 700,000 production milestone, it's not Mahindra, Sonalika, Swaraj",2024-07-22
"New electric LCV enters market, 1250kg payload capacity, 140km range. Not Tata, Mahindra model",2024-07-18
Have you downloaded the latest issue of AUTO TODAY magazine yet?,2024-07-16
"Confirmed 5 car, motorcycle launches till August 15",2024-07-16
"This company has got 2,104 fully built bus order from MSRTC, not Tata, Mahindra, Volvo",2024-07-15
"Another CNG 2W entering market. It is a scooter, but not Activa, Access or Ntorq",2024-07-11
Mahindra on hybrid: Firmly believe that it is an interim and costly solution,2024-07-10
"Brezza, Baleno, Swift, other Maruti cars to now have 3-year/1,00,000km standard warranty",2024-07-09
"Buying a hybrid Maruti, Toyota, Honda car in Uttar Pradesh? Save in lakhs as registration fee waived",2024-07-08
Hyundai Motor India Foundation onboards 20 para-athletes under Samarth Para-Sports programme,2024-07-08
"Not Hyundai, Tata or Mahindra, but this company has dispatched 2 million vehicles via Indian Railways",2024-07-08
"Bajaj CNG bike, likely to called Freedom 125, launch in India today",2024-07-05
SUVs continue to dominate car sales with 5 in top 10 in June,2024-07-03
"BMW clocks highest-ever half-yearly car sales in India, crosses 2,000 electric car sales",2024-07-02
Monsoon car safety advisory: Driving in rainy season? Precautions to be taken,2024-07-02
"Sonet drives Kia sales in June, carmaker reports 10% growth",2024-07-01
2024 BMW 5 Series LWB for India – first look,2024-06-29
"This Indian EV maker to set up new plant in Maharashtra, already has two in Tamil Nadu",2024-06-28
Royal Enfield Guerrilla 450 teased,2024-06-28
BMW announces monsoon service campaign,2024-06-28
Meet a luxury carmaker that is on a mission to convert kilometres into trees,2024-06-27
Michelin X Multi Energy Z+ truck and bus tyre launched,2024-06-27
"This 3-row SUV has reached 200,000 units sales mark in under 3 years. Not Tata Safari, MG Hector Plus",2024-06-27
Hyundai Inster EV makes global debut,2024-06-27
Four new energy storage products to be launched at IESW 2024,2024-06-26
"Fully built 50,000th bus rolls out from this company's MP plant. Not Tata or Mahindra",2024-06-26
"This Indian auto giant sets up plant in Brazil, selling in 100 countries now, not Hero or Royal Enfield",2024-06-26
"Toyota Urban Cruiser Taisor review, first drive",2024-06-26
"Maruti, Hyundai, Tata-rival announces ownership service camp for its Ertiga, Creta, Nexon opponents",2024-06-25
"Hero motorcycles, scooters to get expensive from July 1, select models to witness price hike",2024-06-24
Have you downloaded the latest issue of AUTO TODAY magazine yet?,2024-06-23
"Ola announces offers up to Rs 15,000 on S1 portfolio",2024-06-21
"Not Tata, Hyundai or Toyota but this carmaker is aiming to sell 600,000 CNG cars in FY25",2024-06-21
"Meet India's most fuel-efficient CV tyre, saves up to 15% fuel",2024-06-20
Indian auto industry grew 19% to Rs 10.2 lakh crore in FY24,2024-06-19
"India's biggest IPO till date? This carmaker could give Maruti, Tata, Mahindra a run for their money",2024-06-15
"Creta,-maker files draft papers with Sebi for Rs 25,000 crore IPO",2024-06-15
"Nitin Gadkari lauds Tata Motors as Punch.ev, Nexon.ev score 5-star Bharat NCAP rating",2024-06-13
"This company has surpassed 250,000 vehicle export milestone with just 3 cars, top model is Hyundai Creta rival",2024-06-13
First chapter of Volkswagen Experiences flagged off,2024-06-11
"This Swedish EV company is all set to manufacture e-3Ws in India, new facility coming up in Pune",2024-06-11
"Elections, extreme heat dent car retail sales in May, 2W segment sees uptick on positive rural demand",2024-06-10
Maruti Suzuki commences pilot biogas plant at Manesar facility,2024-06-05
"This MPV has crossed 1.5 lakh sales in 27 months, it's not Maruti Ertiga or Toyota Innova",2024-06-05
2024 Mercedes-Maybach GLS 600 and Mercedes-AMG S 63 E Performance launched in India,2024-05-29
"Strong SUV portfolio and wide sales, service network bolster Hyundai's rural India aspirations",2024-05-28
"Maruti opens 5,000th service touchpoint, this city gets the milestone facility",2024-05-28
"200 units of this Chinese electric car delivered in a day in India, these are the top cities",2024-05-27
"KTM 250 Duke, KTM 200 Duke get new colours, more details here",2024-05-21
First Israeli auto firm sets up manufacturing unit in India,2024-05-20
Have you downloaded the latest issue of AUTO TODAY magazine yet?,2024-05-18
"Tata Motors Q4 results: Consolidated profit rises 219% as JLR, PV, CV businesses shine",2024-05-10
"This Rs 6.49 lakh Maruti car has been developed with Rs 1,450 crore investment",2024-05-09
Kia EV3 compact electric SUV teased ahead of world premiere on May 23,2024-05-07
"This Thar rival halts Maruti's SUV march even as Brezza, Fronx shine",2024-05-06
"Top 10 cars in April: Maruti drives with 7 models, 1 each for Tata, Hyundai, Mahindra",2024-05-06
"Bajaj Pulsar NS400Z launched in India, priced at Rs 1,85,000",2024-05-03
"This SUV is driving Hyundai sales in 2024, we are not talking about Exter, Venue",2024-05-01
Maruti Suzuki Q4 results: Net profit rises,2024-04-26
"Bharat NCAP results of Baleno, Brezza, Grand Vitara to be out any time: Maruti",2024-04-26
"Maruti is working on making 6 airbags standard on some models, says MD and CEO",2024-04-26
This SUV has reached 4 lakh sales in under 4 years,2024-04-26
Ferrato Disruptor bookings open in India,2024-04-26
"Only 3 SUVs in India have clocked 1 million sales, not Nexon, Seltos, Bolero, Fortuner",2024-04-25
Mahindra achieves tractor sales milestone of 40 lakh units,2024-04-25
"Honda rides on success of SP125, Activa in East India",2024-04-25
"50 years of Swaraj: Company unveils limited edition tractor variants, new CSR program",2024-04-24
"Bridgestone eyes 25% revenue, 11% volume growth in India by 2026",2024-04-21
Elon Musk is not coming to India but be assured that Tesla is,2024-04-20
"Bajaj eyeing big bike space for Rs 15,000 crore Pulsar brand",2024-04-18
"Bajaj Auto Q4 results: Net profit rises 35% at Rs 1,936 crore",2024-04-18
From Access 125 to Hayabusa: Suzuki reaches 80 lakh production mark,2024-04-18
"Tata Motors to use new USD 1 bln plant to make Jaguar Land Rover cars, sources say",2024-04-18
"This e-scooter is cheaper than Hero Splendor, Honda Activa; 95km range, 85kmph top speed at Rs 69,999",2024-04-15
"Don't get over-excited about electric cars, Indian market is still at nascent stage",2024-04-15
"Surprise! No Maruti car in top 2 in March 2024 as Tata, Hyundai SUVs drive ahead",2024-04-12
This Made-in-India electric car is now being exported to Indonesia,2024-04-11
This IIT Kanpur startup just developed wireless charging system for EVs,2024-04-11
"Prices hiked for 2 of Maruti's best-sellers; get ready to pay more for Swift, Grand Vitara",2024-04-10
"1 lakh bookings in just 3 months for this best-selling SUV; Kia Seltos, Maruti Suzuki Grand Vitara-rival",2024-04-10
"This company just launched new tyre range for premium SUVs, CUVs, sedans, hatchbacks",2024-04-10
"New electric truck from this startup can achieve 10-80% charge in 20 minutes, reach 120kmph top speed",2024-04-09
Indigenously developed Tresa V0.2 18-tonne electric truck unveiled,2024-04-09
"This Indian car brand has finally broken Maruti Suzuki's dominance, emerges best-seller in March 2024",2024-04-09
"This plant can now produce 9 lakh Maruti cars every year, capacity enhanced by 1 lakh units",2024-04-09
"You thought Swift, WagonR, Ignis had poor safety ratings? This car is worse",2024-04-09
"This SUV will be launched in all-black avatar on April 10; Hyundai Creta, Kia Seltos, Tata Harrier-rival",2024-04-08
"Jaguar Land Rover sales grow over 20% in FY24 on improved production, sustained global demand",2024-04-08
"Hyundai, Kia join hands with this Indian company for EV battery localisation",2024-04-08
"Maruti leads car retails, Tata closes gap with Hyundai, Mahindra shines in FY24",2024-04-08
"Not Tata or Ashok Leyland, this start-up has bagged order for 1,000 electric trucks",2024-04-04
"This popular Hyundai SUV has offers up to Rs 35,000 in April. Is it Creta or Venue?",2024-04-04
"BMW i5 bookings open in India, 5th electric BMW car",2024-04-04
Mahindra XUV300 facelift to be unveiled as Mahindra XUV 3XO on April 29,2024-04-04
"This Indian SUV beat all Japanese, Korean rivals to emerge as best-seller",2024-04-04
"This company began manufacturing in India 40 years ago, has produced 3 crore cars till now",2024-04-03
"Top 10 selling cars in FY24: WagonR retains crown, Nexon drives SUV demand",2024-04-03
Hyundai comfortably beats Tata to remain second largest carmaker in India in FY24,2024-04-03
Toyota Taisor to debut in India,2024-04-03
SUVs propel India to 3rd largest car market in the world in FY24,2024-04-02
"Hyundai Creta records best annual performance in FY24, continues to rule mid-size SUV segment",2024-04-02
This electric scooter from Ola can ride on its own; fully autonomous & 100% made-in-India,2024-04-02
"No 2WD, no price cuts for Jimny, says Maruti Suzuki India",2024-04-02
32 BMW iX EVs were just inducted into this company's fleet,2024-03-28
This Japanese company has now sold 6 crore two-wheelers in India,2024-03-28
Toyota cars to get expensive from April 1,2024-03-28
"This Maruti SUV alone has more sales than that of Renault, Nissan, Citroen combined in FY24",2024-03-28
"Maruti Suzuki Grand Vitara, Invicto hybrid claimed range over 1,200km on a single full tank",2024-03-28
"Maruti rejigs senior management personnel, Partho Banerjee to be new marketing and sales head",2024-03-27
"Appalling result, says Global NCAP, as Citroen E-C3 performs poorly",2024-03-27
Have you downloaded the latest issue of AUTO TODAY magazine yet?,2024-03-27
Sonalika Sikander DLX DI 60 Torque Plus tractor launched in India at Rs 8.50 lakh,2024-03-26
Citroen Basalt SUV coupe set for debut on March 27,2024-03-26
"Maruti Suzuki Baleno, WagonR recalled: Over 16,000 units impacted",2024-03-22
"Kia Seltos, Sonet, Carens prices to rise from April 1",2024-03-22
"Conserved over 650 million litres of water in 5 years, says Hyundai",2024-03-22
Volkswagen ID.4 launch in India in Q4 2024,2024-03-21
"Volvo XC40 Recharge single motor variant bookings start, here are more details",2024-03-19
Tata Motors inaugurates 5th vehicle scrapping facility,2024-03-19
Maruti Suzuki Fronx-based Toyota Taisor ready to debut on April 3,2024-03-18
Nissan-Honda partnership: Japanese companies to join hands for EV collaboration,2024-03-15
"This tractor maker is set to invest Rs 1,300 crore in Punjab for 2 new facilities",2024-03-14
"10,000 subscribers are driving Maruti cars without ownership burden. This is how",2024-03-14
Explaining government's Electric Mobility Promotion Scheme 2024,2024-03-13
Maruti Suzuki Baleno vs Hyundai i20 vs Tata Altroz: March 2024 offers compared,2024-03-13
"Maruti Suzuki takes pole position in domestic sales, exports from India",2024-03-12
PM Modi inaugurates India's first automobile in-plant railway siding at Suzuki Motor Gujarat,2024-03-12
Hyundai Creta N Line launch today: Top details that you should know,2024-03-11
Tata Motors reaches production milestone of 1 million units at Sanand plant,2024-03-08
Hyundai's CSR arm facilitates employment of 250 women drivers under Drive4Progress initiative,2024-03-08
"Hyundai Creta-rival Maruti Suzuki Grand Vitara has offers up to Rs 87,000 in March",2024-03-07
Ford Endeavour spotted in India,2024-03-07
Volvo XC40 Recharge single motor variant launched at Rs 54.95 lakh,2024-03-07
"10 best-selling SUVs in February 2024: Punch, Brezza lead as Creta, Scorpio impress",2024-03-06
Hyundai Creta N Line interiors revealed ahead of March 11 launch,2024-03-06
XLRI to set-up Indian School for Design of Automobiles,2024-03-05
"MG Comet EV, ZS EV get new variants; check details here",2024-03-05
"Tata Punch way ahead of Hyundai Exter in volume, February wholesales will surprise you",2024-03-05
"Ola S1 Pro gets PLI certification, second model after Ola S1 Air",2024-03-04
Tata Motors to demerge businesses into 2 separate listed companies,2024-03-04
Ather Rizta electric scooter unveil in India on April 6,2024-03-04
"Discounts on Hyundai cars up to Rs 43,000 in March, here are complete details",2024-03-04
Car sales in India: February 2024 turns out to be another record month,2024-03-04
Tata Motors beats Hyundai in domestic car sales in February 2024,2024-03-01
"ICE vehicles will keep getting costlier to buy and use, says Ola's Bhavish Aggarwal",2024-03-01
"Rolls-Royce Arcadia Droptail unveiled, check details here",2024-02-29
"Kia Seltos, Sonet, Carens have lowest maintenance cost: Frost & Sullivan",2024-02-29
"Skoda compact SUV launch in India in H1 2025; Tata Nexon, Maruti Suzuki Brezza, Hyundai Venue-rival",2024-02-28
World Car Awards 2024 - Top 3 finalists in each category announced,2024-02-27
"Hyundai Nios, i20, Aura, Venue: Benefits up to Rs 43,000 in February",2024-02-23
"Joy e-bike reaches electric two-wheeler sales milestone of 100,000 units",2024-02-20
"Mahindra Scorpio, Thar, XUV700 witness dip in avg monthly bookings in Q3 FY24",2024-02-16
"Ola S1 electric scooter range gets significant price cuts, check details here",2024-02-16
Exclusive | Creta has made Hyundai a household name in India: Tarun Garg,2024-02-12
Exclusive | BMW to localise EV portfolio in India as volume grows,2024-02-09
"Servicing 2 million vehicles every month, says Maruti",2024-02-06
"Exclusive | Volkswagen expects higher sales contribution from Tier 2, 3 markets",2024-02-05
Have you downloaded the latest issue of AUTO TODAY magazine yet?,2024-02-04
"Interim Budget 2024: EV ecosystem will get a boost, say auto sector analysts",2024-02-01
"Budget 2024: Government to expand EV ecosystem, charging infrastructure",2024-02-01
"Maruti Q3 results: Net profit rises 33%, revenue jumps 15%",2024-01-31
"Bharat Mobility Global Expo 2024: Tata Motors to showcase concept versions of Nexon i-CNG, Curvv, Harrier.ev",2024-01-31
"Bharat Mobility Global Expo 2024: Check date, venue, registration, participants, other details here",2024-01-31
Kinetic Luna electric launch in India on February 7,2024-01-30
Mahindra in collaboration with Auto Today flags off 'Drivers of Change' initiative honouring women achievers,2024-01-25
TVS Motor Company Q3 results: Net profit rises 68% on healthy volume growth,2024-01-24
"Bajaj Auto Q3 results: Strong domestic show leads to record revenue, EBITDA, net profit",2024-01-24
"Tata Motors opens bookings for Tiago CNG AMT, Tigor CNG AMT",2024-01-24
Maruti Suzuki Fronx becomes fastest car in India to reach sales mark of 1 lakh units,2024-01-24
"Royal Enfield Bullet 350 gets silver hand-painted pinstripes, check price here",2024-01-24
Tata Motors to increase car prices from February 1,2024-01-23
Hero Mavrick 440: Here are all details about new mid-weight contender,2024-01-23
Jeep Wagoneer S electric SUV global launch in 2024,2024-01-22
"Tata Punch EV: Range, battery packs, charging options explained",2024-01-22
"Royal Enfield Shotgun 650: Price, colours, India deliveries, other details",2024-01-22
Hyundai Creta 2024 facelift: Top details you should know,2024-01-22
Solis unveils 2 new tractors for global markets,2024-01-19
Carlos Sainz and Audi clinch Dakar 2024 victory,2024-01-19
"Kia Seltos diesel MT launched at Rs 11,99,900",2024-01-19
Hyundai completes acquisition of General Motors' Talegaon plant,2024-01-19
"Record volume for Lamborghini in 2023: Sells over 10,000 cars for first time in history",2024-01-17
"Tata Punch EV launched in India: Check price, range, charging options, features, colours",2024-01-17
Hyundai Creta 2024 facelift: 5 most important things you should know,2024-01-17
"Tata Punch EV launch LIVE: New Punch EV price, colours, variants, bookings",2024-01-17
"Hyundai Creta 2024 facelift launch today. Check expected price, features, specs",2024-01-16
Tata Punch.ev launch in India on January 17,2024-01-15
Saurabh Vatsa joins Nissan Motor India as Deputy Managing Director,2024-01-15
"Volvo Car India defers price hike for EVs, increases prices of ICE models",2024-01-15
"BMW Group India clocks best-ever annual sales in 2023, leads luxury electric car segment",2024-01-11
"JLR India sales rise 74% in Q3 on robust demand for Range Rover, Range Rover Velar, Defender",2024-01-11
"Maruti to set up new plant in Gujarat with Rs 35,000 crore investment",2024-01-10
"2024 Hyundai Creta facelift fully revealed in new images, check here",2024-01-10
"Renault introduces 2024 updates of Kiger, Triber, Kwid",2024-01-09
"Tata Motors Group global wholesales at 338,177 units in Q3 FY24",2024-01-09
"2024 Mercedes-Benz GLS review, first drive",2024-01-08
Honda inaugurates new assembly line at Gujarat plant,2024-01-08
"Hyundai commits additional Rs 6,180 crore investment in Tamil Nadu",2024-01-08
"2024 Hyundai Creta facelift design sketches revealed: Check features, specs, price, other details",2024-01-08
"2024 Hyundai Creta facelift to have over 70 safety features, level 2 ADAS",2024-01-05
"Tata Punch.ev revealed; check price, range, features, specs, booking details",2024-01-05
No discounts on 2024 stock of Maruti Suzuki Jimny,2024-01-04
Royal Enfield Hunter 350 now available in 2 more colour options,2024-01-04
"Hyundai Creta facelift is available in 28 trim, engine, transmission combinations | Get complete details",2024-01-04
"Hyundai Creta facelift: Launch, price, features, specifications, other important details",2024-01-03
Hyundai Creta continues its dominance over mid-size SUV segment,2024-01-03
Maruti Suzuki Brezza beats Tata Nexon in domestic wholesales in 2023,2024-01-03
Have you downloaded the latest issue of AUTO TODAY magazine yet?,2024-01-03
"Exclusive | Top 10 selling cars in India in 2023: Swift drives past WagonR, Baleno as Brezza beats Nexon",2024-01-03
Record car sales in India in 2023: 4 million mark breached for the first time,2024-01-02
Kia India appoints Gwanggu Lee as MD & CEO,2024-01-02
2024 Hyundai Creta bookings open now,2024-01-02
Maruti Suzuki Brezza was the best-selling SUV in India in 2023,2024-01-02
Maruti Suzuki Swift was the largest selling car in India in 2023,2024-01-02
Historic performance by Maruti in 2023,2024-01-01
"Tata Motors clocks record car sales in 2023 as Punch, Nexon, Tiago, Altroz drive growth",2024-01-01
"Hyundai records highest-ever annual domestic volume in 2023 as Creta, Venue, Exter shine",2024-01-01
"Strong show by Mahindra in December, SUV volume grows 24%",2024-01-01
Deepika Padukone is new brand ambassador of Hyundai Motor India,2023-12-29
"Govt has incentivised 11.53 lakh EVs with subsidies worth Rs 5,228 crore under FAME II scheme",2023-12-28
Toyota's Daihatsu stops production after cheating customers over vehicle safety issues for over 30 years,2023-12-28
Maruti to set up second Japan-India Institute for Manufacturing in Haryana,2023-12-22
Have you downloaded the latest issue of AUTO TODAY magazine yet?,2023-12-20
"2024 Kia Sonet deliveries to start in January, diesel MT buyers to wait till February",2023-12-19
"2024 Kia Sonet: Different engine, transmission, trim combinations explained",2023-12-17
"Creta, Venue, i20 emerge main drivers as Hyundai sells over 5 lakh connected cars in 4 years",2023-12-17
"Gogoro introduces CrossOver series of electric scooters, opens battery swapping network in Delhi & Goa",2023-12-17
"Bharat NCAP completes maiden round of crash tests, results expected later this month",2023-12-17
Audi India and ChargeZone inaugurate 450kW ultra-fast charging station in Mumbai,2023-12-15
Mahindra Scorpio-N: From 5 stars at GNCAP to 0 stars at ANCAP,2023-12-15
JK Tyre unveils new Off-the-Road range of tyres at EXCON 2023,2023-12-14
"2024 Kia Sonet facelift unveiled in India, bookings to open on December 20",2023-12-14
Bharat NCAP crash testing to start from December 15,2023-12-13
India Today and Bosch Global Software enter strategic partnership,2023-12-13
"Volkswagen Virtus, Taigun, Tiguan: Carmaker to increase prices by up to 2% from January 1",2023-12-12
"India-made Jimny is offered with ADAS in Australia, get complete details here",2023-12-12
"Hyundai cars have benefits, discounts of up to Rs 3 lakh, get complete details here",2023-12-11
"Kia Sonet has lowest maintenance cost, highest residual value in compact SUV segment",2023-12-11
"Our consumer is not showing any inclination towards CNG, says Kia's Hardeep Singh Brar",2023-12-11
"BMW cars to become more expensive from January 1, prices set to rise by up to 2%",2023-12-11
"MG Comet EV, ZS EV, Astor, Hector, Gloster have benefits up to Rs 1.50 lakh in December",2023-12-10
Maruti offers massive discount on Jimny as sales continue to fall,2023-12-09
"Tata Punch ahead of Hyundai Exter in November sales, 5 months in a row now",2023-12-08
Planning to buy a new car in January? Get ready to pay more,2023-12-07
"Cyclone Michaung: Maruti, Hyundai, Tata, Mahindra, Toyota announce customer support initiatives",2023-12-07
Tata Motors beats Hyundai Motor India in car retail sales in November 2023,2023-12-06
Maruti's SMG facility achieves production milestone of 3 million units,2023-12-06
"Cyclone Michaung: Maruti Suzuki reaches out to customers in affected areas of Chennai, Andhra Pradesh",2023-12-06
"Rapido introduces cab service, claims zero commission from drivers",2023-12-05
"Mahindra Scorpio beats Hyundai Creta in November sales, two months in a row now",2023-12-05
