Headline,Date
Spinny looks to further strengthen position in existing markets,2022-11-27
"Can't forget motorcycles if want true electric adoption, says Matter founder & CEO",2022-11-27
"Hero Motocorp to increase motorcycle, scooter prices by up to Rs 1,500 from Dec 1",2022-11-25
"Spinny Park with 1,000 car-capacity opened in Bengaluru",2022-11-24
Hero Electric partners with Battrixx to develop lithium-ion batteries,2022-11-21
"Flipkart expands EV options, brings Okaya electric 2Ws on platform",2022-11-18
"Large portfolio, wide sales & service network give us strong base to connect with customers: Maruti MD & CEO",2022-11-18
"Altigreen looks to disrupt electric 3W space with product, network, capacity expansion",2022-11-18
"Mahindra SUV pending orders at nearly 260,000: Scorpio, XUV700 most preferred models",2022-11-15
"EMotorad Doodle V2 foldable e-bike launched at Rs 49,999",2022-11-15
"Vida V1 electric scooter customer test rides start, maiden Vida experience centre opened in Bengaluru",2022-11-15
Indian Racing League to be held at India's first permanent racing circuit at Chennai,2022-11-14
EICMA 2022: Benelli BKX 250 Adv breaks cover,2022-11-09
Royal Enfield Super Meteor 650 revealed,2022-11-08
"Tata Motors reaches production milestone of 50,000 EVs",2022-11-08
New generation Ducati Scrambler revealed: Here are all the details,2022-11-08
Festivities bring cheer as auto retail zooms past pre-Covid period in October,2022-11-07
Maruti crosses production milestone of 2.5 crore units,2022-11-02
Have you downloaded the latest issue of AUTO TODAY magazine yet?,2022-11-02
Maruti gains share in mid-size SUV segment amid push from Grand Vitara,2022-11-01
"Ola Electric sales in October 2022: Company clocks record volume of 20,000 units",2022-11-01
"Hyundai looking at record volume in 2022, clocks 30% growth in domestic sales in October",2022-11-01
"Tata Motors continues strong show, domestic PV volume grows 33% in October",2022-11-01
Maruti's domestic PV volume rises 29% in October,2022-11-01
Ola S1 Air: EV startup aims to end ICE dominance in mass scooter segment with new electric model,2022-10-22
Niobium powers Landspeed Record candidate Lightning Tachyon Nb,2022-10-21
Maruti opens applications for Cohort 8 of mobility startup program,2022-10-20
Polestar 3 debuts as the second production model from the brand with 610km range,2022-10-17
"Bajaj Auto Q2 FY23 results: Net profit rises 20%, revenue & EBITDA at record level",2022-10-14
"New UP EV policy: Check all the incentives, subsidies for buyers here",2022-10-13
"Nexon, Punch, Tiago, Altroz, others: 4-12 week waiting period on Tata cars, SUVs",2022-10-13
"PV segment records highest-ever H1 sales, struggle continues for 2W segment",2022-10-13
"Navaratri 2022: PV, 2W retails zoom past pre-Covid levels",2022-10-10
Audi bids farewell to R8 with the limited edition R8 V10 GT RWD,2022-10-10
Customers more likely to note Grand Vitara's starting price: Maruti's Srivastava,2022-10-10
Mahindra Scorpio-N waiting period will blow away your mind!,2022-10-08
"Mahindra XUV300 TurboSport vs Hyundai Venue N Line: Price, specs compared",2022-10-08
Vida V1 electric scooter: Read all technical specifications here,2022-10-08
"Total discount of up to Rs 60,000 on Tata cars, SUVs",2022-10-08
"Jaguar Land Rover retails, wholesales increase in second quarter; chip shortage still a concern",2022-10-07
"September electric two-wheeler retail sales: Growth visible, pace remains slow",2022-10-06
Honda City completes 25 years in India,2022-10-06
"Nexon, Punch help Tata Motors reach best-ever quarterly PV volumes",2022-10-06
"Hunter 350, Scram 411, Classic 350, Bullet, others: Royal Enfield posts 170% rise in domestic volumes",2022-10-05
"Honda City, Amaze, Jazz, WR-V: Offers up to Rs 39,300 in October",2022-10-05
"Maruti Suzuki Grand Vitara pending bookings reach 60,000",2022-10-05
"Grand Vitara, Baleno, Brezza, others: Maruti expands car subscription program to 5 new cities",2022-10-06
"LML to launch three electric two-wheeler models in 2023, unveils their concept versions",2022-09-29
Maruti Suzuki Grand Vitara vs Hyundai Creta: Comparing base variants of mid-size SUVs,2022-09-29
Tata Motors' electric vehicle portfolio to have 10 models by 2026,2022-09-29
"Maruti festive offer: Over Rs 40,000 discount on this new model, get all details here",2022-10-06
Honda races ahead of Hero MotoCorp in retail sales in September,2022-10-04
"Ola tops e-2W sales in September; beats Okinawa, Hero, Ather",2022-10-04
"Zontes model range prices announced, starts at Rs 3.15 lakh",2022-10-04
"September retail sales: PV segment drives smoothly, rough ride continues for 2W segment",2022-10-04
2023 BMW S 1000 RR gains more power,2022-10-04
Kia Carens recalled to inspect fault in airbag control module software,2022-10-04
"Tata Tiago.ev complete technical specifications explained: Motor, battery, charging, range, all other details",2022-09-28
"Hero MotoCorp announces new offers, schemes under festive campaign",2022-09-26
Maruti Suzuki looks to improve market share with new Grand Vitara,2022-09-26
Mahindra to unveil five electric cars on 15th August,2022-08-08
New Hyundai Creta launch in India in 2024,2022-10-03
"Scorpio, XUV700, Thar, others: Mahindra posts highest-ever monthly SUV volumes in September",2022-10-03
"Seltos, Sonet, Carens, Carnival: Record sales for Kia in September",2022-10-03
Aston Martin DBX 707 launched in India at Rs 4.63 crore,2022-10-03
Suzuki Motorcycle introduces new colour for Access 125 scooter,2022-10-03
"Skoda Kushaq becomes third SAVWIPL export vehicle after VW Taigun, VW Virtus",2022-10-03
Lamborghini debuts luxury-oriented Urus S,2022-10-03
"Record PV despatches in September as festive rush, robust demand propel growth",2022-10-01
"Tata Tiago EV first look - exterior, interior, features, specifications & price",2022-10-01
Citroen Oli: French carmaker debuts fresh logo on quirky new concept EV,2022-09-30
BMW debuts XM super-SUV with a 644bhp hybrid powertrain,2022-09-30
India to host MotoGP in 2023: Bharat GP is a go!,2022-09-30
"Planning to bring home Tata Tiago EV? Check out range, price, bookings details, delivery time here",2022-09-30
Piaggio rebrands spare parts business,2022-09-28
"EV adoption: India needs to invest over $10 billion to boost cell manufacturing, says new report",2022-09-28
"Tata Tiago EV launch tomorrow, here is what other companies are planning",2022-09-27
"Navaratri festive offer: Ola S1 Pro has flat Rs 10,000 discount",2022-09-27
"Toyota Urban Cruiser Hyryder full price-range announced, starts at Rs 10.48 lakh",2022-09-28
"Tata Tiago EV launch today, here are important details you should know",2022-09-28
"Omega Seiki to deploy over 5,000 Rage+ e-3Ws in collaboration with Porter by 2023-end",2022-09-27
Citroen's new logo to debut on a concept model later this month,2022-09-27
Last Lamborghini Aventador rolls off the line marking the end of the NA V12,2022-09-27
"Maserati reveals new GranTurismo, powered by the V6 from the MC20",2022-09-27
Hero Electric to set up plant with 2 million units-capacity in Rajasthan,2022-09-27
Navaratri 2022: Mahindra Scorpio-N deliveries start,2022-09-26
"2024 Ford Mustang unveiled, retains V8 and manual transmission",2022-09-26
Grand Vitara vs Creta vs Seltos vs Kushaq vs Taigun: Price comparison,2022-09-26
"Tata Motors launches Yodha 2.0, Intra V20 bi-fuel and Intra V50 pickups",2022-09-26
"2022 Citroen C5 Aircross review, first drive",2022-09-24
Flavours of Jaipur ft. Hyundai i20 N Line - Food Trails,2022-09-23
"Mercedes-Benz EQS 580 launch on September 30, bookings open",2022-09-20
Maruti Suzuki Grand Vitara price announcement on September 26,2022-09-22
MotoGP is coming to India - MotoGP Bharat as early as 2023?,2022-09-22
Volvo launches 2023 model range with mild-hybrid powertrains in India,2022-09-21
Flavours of Lucknow ft. Hyundai Alcazar - Food Trails,2022-09-21
Interview with Moto2 rider Celestino Vietti,2022-09-20
"Mahindra Scorpio Classic review, first drive",2022-09-19
Jehan Daruvala wins F2 Feature race at Monza,2022-09-12
Have you downloaded the latest issue of AUTO TODAY magazine yet?,2022-09-18
"Maruti Suzuki Grand Vitara review, first drive",2022-09-18
Ferrari 296 GTB launched in India at Rs 5.40 crore,2022-09-15
Fisker to enter India with Ocean and PEAR,2022-09-15
Dandera OTUA electric three-wheeler for last-mile delivery launched,2022-09-14
Ferrari debuts the four-door Purosangue with 715bhp,2022-09-14
Pagani debuts the Utopia with 852bhp,2022-09-13
TVS Ntorq 125 Race Edition now in three colours,2022-09-13
Toyota Urban Cruiser Hyryder prices announced,2022-09-09
Citroen C5 Aircross facelift launched at Rs 36.67 lakh,2022-09-08
Mahindra unveils all-electric XUV400 with 456km of range,2022-09-08
Honda Amaze crosses 5 lakh unit sales milestone,2022-09-07
MG teases updated interior for 2022 Hector,2022-09-07
Hyundai Venue N Line launched at Rs 12.16 lakh,2022-09-06
HOP OXO electric motorcycle launched at Rs 1.25 lakh,2022-09-05
"Renault launches Festive Limited Editions for Kiger, Triber and Kwid",2022-09-02
Kia Sonet X Line launched at Rs 13.39 lakh,2022-09-02
"Tata Jet Edition: Safari, Harrier, Nexon and Nexon EV first look",2022-09-02
Skoda registers highest ever annual sales in India,2022-09-01
2022 MG Gloster launched at Rs 31.99 lakh,2022-09-01
"Mahindra XUV400 electric SUV teased, will be unveiled on September 8",2022-08-31
Toyota temporarily suspends bookings for Innova Crysta diesel amid long waiting periods,2022-08-31
"Skoda Vision 7S previews new design ideology, also debuts new brand logo",2022-08-31
2022 Audi Q3 launched in India at Rs 44.89 lakh,2022-08-30
Mahindra Scorpio-N deliveries to commence from 26 September,2022-08-29
Mercedes-Benz India appoints Santosh Iyer as MD and CEO,2022-08-29
Have you downloaded the latest issue of AUTO TODAY magazine yet?,2022-08-27
"Tata Safari, Harrier and Nexon Jet editions launched",2022-08-27
New Audi Approved: plus facility inaugurated in Nagpur,2022-08-26
The Bugatti W16 Mistral marks the end of the iconic W16 engine,2022-08-26
Ducati Streetfighter V2 launched at Rs 17.25 lakh,2022-08-26
2022 Range Rover walkaround - First look,2022-08-26
Audi confirms Formula 1 participation from 2026,2022-08-26
The Koenigsegg CC850 is a tribute to the brand's first production car,2022-08-26
Lamborghini Huracan Tecnica launched at Rs 4.04 crore,2022-08-25
BMW X7 40i M Sport 50 Jahre M Editon launched at Rs 1.20 crore,2022-08-25
Hyundai Venue N Line bookings open,2022-08-25
Skoda India appoints Petr Solc as Director of Sales and Marketing,2022-08-24
"Hyundai Venue N Line to be launched in Metaverse, details here",2022-08-24
First 2022 Maserati Levante Hybrid delivered in India,2022-08-24
India-spec Mercedes-AMG EQS 53 launched at Rs 2.45 crore,2022-08-24
Skoda reveals exterior sketches of Vision 7S concept car,2022-08-24
Audi cars to get costlier from September 20,2022-08-23
"Mercedes-AMG EQS 53 launch tomorrow, details here",2022-08-23
"McLaren confirms India entry, launch in second half of 2022",2022-08-22
"Kia teases Sonet X Line, launch soon",2022-08-22
The new Lamborghini Urus Performante is a 666bhp Super-SUV,2022-08-22
Bentley Mulliner Batur: most powerful Bentley ever limited to 18 units,2022-08-22
Mahindra Scorpio Classic launched at Rs 11.99 lakh,2022-08-19
India's cricket bat capital ft. Hyundai i20 N Line - Magnificent India,2022-08-18
75 units of Citroen C3 delivered on 75th Independence Day,2022-08-18
2022 Maruti Suzuki Alto K10 launched at Rs 3.99 lakh,2022-08-18
"BMW Motorrad launches touring range, BMW R 1250 RT, K 1600 Bagger, K 1600 GTL and K 1600 Grand America",2022-08-17
Hyundai Venue N Line launch on September 6,2022-08-17
"Skoda Kodiaq bookings reopened, prices hiked",2022-08-16
Maruti Suzuki Swift S-CNG launched at Rs 7.77 lakh,2022-08-16
Mahindra and Volkswagen explore further EV cooperation,2022-08-16
"Ola electric car partially revealed, launch in 2024",2022-08-16
"Ola launches S1 electric scooter at Rs 99,999",2022-08-16
"Five electric SUVs unveiled by Mahindra, first launch in 2024",2022-08-15
Kia Seltos crosses 3 lakh unit sales milestone in less than three years,2022-08-12
Mahindra Racing signs Lucas Di Grassi for the 2023 Formula E season,2022-08-12
"Tachyon NB, electric superbike developed to cross 400kmph mark",2022-08-12
"Mahindra Scorpio Classic exterior, interior, specs and features revealed",2022-08-12
Upcoming Lamborghini Urus breaks Pikes Peak hill climb record,2022-08-12
BMW M4 Competition 50 Jahre M Edition launched at Rs 1.53 crore,2022-08-11
2022 Maruti Suzuki Alto K10 bookings open,2022-08-11
"2022 Audi Q3 bookings open, trims and features revealed",2022-08-11
Jeep Compass 5th Anniversary Edition launched at Rs 24.44 lakh,2022-08-10
"2022 MG Hector teased, gets updated front fascia",2022-08-10
2022 Hyundai Tucson launched at Rs 27.68 lakh,2022-08-10
"Lamborghini teases off-road supercar, Huracan Sterrato",2022-08-09
Mahindra launches Jeeto Plus CNG 400 at Rs 5.26 lakh,2022-08-09
Apollo Tyres launches tyres for Electric passenger vehicles and two wheelers,2022-08-08
"Royal Enfield Hunter 350 revealed, all details here",2022-08-05
"2022 Hyundai Tucson first look, ADAS safety features explained",2022-07-23
BMW launches 5 Series 50 Jahre M Edition in India at Rs 67 lakh,2022-07-22
Mercedes-AMG EQS 53 launch on 24th August,2022-07-22
Mahindra Scorpio-N automatic and 4WD prices revealed,2022-07-22
Have you downloaded AUTO TODAY July 2022 issue yet?,2022-07-21
Maruti Suzuki Grand Vitara unveiled,2022-07-20
Citroen C3 launched in India at Rs 5.71 lakh,2022-07-20
"2022 Maruti Suzuki S-Presso gets updated engine, more features",2022-07-19
2022 Hyundai Tucson bookings open ahead of its launch on August 4,2022-07-18
BMW G 310 RR launched in India at Rs 2.85 lakh,2022-07-16
2022 Audi A8 L launched in India at Rs 1.29 crore,2022-07-13
"India-spec 2022 Hyundai Tucson unveiled, launch on August 4",2022-07-13
"Tata Nexon EV gets more features, rebranded as Nexon EV Prime",2022-07-12
New Range Rover deliveries commence in India,2022-07-12
"Maruti Suzuki's Hyundai Creta, Kia Seltos rival will be called Grand Vitara",2022-07-11
Maruti Suzuki to bet big on hybrids over the next 5 years: Explained,2022-07-07
Kia dealership in Gurugram gets India's first 150kW DC fast charger,2022-07-06
2022 TVS Ronin launched at Rs 1.49 lakh,2022-07-06
"Mini Cooper SE electric hatchback bookings re-open, features added",2022-07-06
"2022 Maruti Suzuki Brezza review, first drive",2022-07-06
Maruti Suzuki Vitara unveil on July 20: Everything on Maruti's Creta rival,2022-07-06
TVS Ronin revealed in leaked images: What we know so far,2022-07-04
"Toyota Urban Cruiser Hyryder hybrid SUV unveiled, bookings open",2022-07-01
"2022 Mahindra Scorpio-N Review, First Drive",2022-06-30
"New 2022 Maruti Suzuki Brezza launched - Price, features, specs and all you need to know",2022-06-30
Hyundai Ioniq 6 electric car unveiled to take on Tesla Model 3,2022-06-29
Mahindra Scorpio-N launched at Rs 11.99 lakh,2022-06-27
"Bharat NCAP safety rating for cars based on crash tests coming April 1, 2023",2022-06-27
Tata Nexon EV catches fire in Mumbai: All details,2022-06-23
BMW's 7 Series and X7 to be used for all VIP movements at Delhi Airport's Terminal 4,2022-06-22
Contessa could make an electric comeback: Here's everything you need to know,2022-06-22
Kia Sonet sales cross 1.5 lakh mark,2022-06-21
"Will TVS motors new motorcycle be called the Zeppelin R, Ronin or Retron?",2022-06-21
2022 Maruti Suzuki Brezza HUD teased: Here's what to expect,2022-06-21
"2022 Maruti Suzuki Brezza teased, Bookings open pan-India",2022-06-20
"Ola Electric tease their upcoming electric car again, or is it cars?",2022-06-20
Have you downloaded AUTO TODAY June 2022 issue yet?,2022-06-20
Winners of Movin'On Challenge Design 2022 announced,2022-06-20
JK Tyre announce motorsport plans for 2022: Gaurav Gill pilot run at WRC Kenya and more,2022-06-18
2022 Hyundai Venue launched at Rs 7.53 lakh,2022-06-16
2022 Mahindra Scorpio-N interiors revealed,2022-06-14
"Citroen C3 review, first drive",2022-06-15
Volkswagen Virtus launched in India at Rs 11.22 lakh,2022-06-09
Porsche India launches Porsche Approved for certified pre-owned cars,2022-06-09
"2022 Hyundai Venue launch on June 16, bookings open",2022-06-06
Kia EV6 launched in India at Rs 59.95 lakh,2022-06-02
"Kia EV6 launch in India tomorrow - price expectations, features, specifications",2022-06-01
2022 Hyundai Venue revealed; launch scheduled for June 16,2022-06-01
"Land Rover Defender 130 unveiled, 340mm longer than Defender 110",2022-05-31
Keeway Sixties 300i and Keeway Vieste 300 price announced,2022-05-31
Tata Avinya electric concept car unveiled,2022-04-29
Hyundai Ioniq 5 India launch confirmed,2022-04-28
2022 Mercedes-Benz C-Class assembly commences ahead of launch,2022-04-28
Respect for all & Right Driving Position - #BeTheBetterGuy,2022-04-28
"Kia EV6 India launch confirmed, bookings open on May 26, 2022",2022-04-22
The Right Way - #BeTheBetterGuy,2022-04-21
Audi urbansphere electric concept breaks cover,2022-04-21
2022 Maruti Suzuki XL6 launched at Rs 11.29 lakh,2022-04-21
2022 Honda Gold Wing Tour launched at Rs 39.20 lakh,2022-04-20
Royal Enfield Meteor 350 gets three new colour options,2022-04-20
Honda City e:HEV hybrid production starts ahead of its launch in May,2022-04-20
Road safety is priority - #BeTheBetterGuy,2022-04-19
Land Rover Discovery Metropolitan Edition bookings open,2022-04-19
2022 BMW F 850 GS and BMW F 850 GS Adventure launched in India,2022-04-18
2022 BMW X4 Silver Shadow Edition launched at Rs 71.90 lakh,2022-04-18
2022 World Car Awards - Hyundai Ioniq 5 crowned World Car of the Year,2022-04-18
"Strom R3 three-wheel EV - 200km range, price Rs 4.5 lakh",2022-04-15
"Solis Yanmar crosses 13,000 tractor sales in India",2022-04-15
2022 Maruti Suzuki Ertiga launched at Rs 8.35 lakh,2022-04-15
"Honda City e:HEV hybrid launch in May, bookings open",2022-04-14
2022 Mercedes-Benz C-Class India launch on May 10,2022-04-13
"Kia Carens review, long term - Intro",2022-04-13
"Volvo XC40 Recharge review, first drive",2022-04-13
Audi RS e-tron GT - TRON legacy,2022-04-13
Volkswagen Virtus launch on June 9,2022-04-12
2022 Maruti Suzuki XL6 bookings open ahead of launch,2022-04-12
Have you downloaded AUTO TODAY April 2022 issue yet?,2022-04-12
Yamaha MT-15 Version 2.0 launched at Rs 1.60 lakh,2022-04-11
2022 Kia Seltos now on sale priced from Rs 10.91 lakh,2022-04-11
"2022 Kia Sonet launched, price starts from Rs 7.15 lakh",2022-04-11
"Triumph Tiger Sport 660 review, first ride",2022-04-11
Nissan Magnite Red edition launched at Rs 7.87 lakh,2022-07-14
BMW launches all-electric i4 at Rs 69.9 lakh,2022-05-26
BMW M marks 50 years with M 50 Jahre Editions,2022-05-26
"Kia EV6 review, first drive",2022-05-25
"Kia EV6 launch in India on June 2, bookings open on May 26",2022-05-24
Hyundai Grand i10 Nios Corporate Edition launched at Rs 6.29 lakh,2022-05-24
Have you downloaded AUTO TODAY May 2022 issue yet?,2022-05-13
New Range Rover Sport unveiled,2022-05-13
Bentley Bentayga extended wheelbase variant unveiled,2022-05-13
New Hyundai Tucson India launch in second half of 2022,2022-05-20
"2022 Mahindra Scorpio revealed, will be sold as Scorpio-N",2022-05-20
"Jeep Meridian launched, price starts from Rs 29.90 lakh",2022-05-19
"New Range Rover Sport price starts from Rs 1.64 crore, bookings open",2022-05-19
BMW 3 Series facelift revealed,2022-05-19
Porsche 718 Cayman GT4 RS launched in India at Rs 2.54 crore,2022-05-18
"2022 TVS iQube launched - Three variants, more colours, 140km range",2022-05-18
Tata Nexon EV vs Tata Nexon EV Max - Features and Specifications comparison,2022-05-19
"Keeway announces India entry with K-Light 250V Cruiser & Vieste 300, Sixties 300i scooters",2022-05-17
"Jeep Meridian prices out on 19th May, deliveries to begin soon",2022-05-17
"Tata Nexon EV Max review, first drive",2022-05-17
Skoda Kushaq Monte Carlo launched at Rs 15.99 lakh,2022-05-13
2022 Mercedes-Benz C-Class launched at Rs 55 lakh,2022-05-10
"Volkswagen Virtus Review, First Drive",2022-05-06
"Tata Ace EV launched, MoU for delivery of 39,000 units signed",2022-05-05
2022 Audi A8 L bookings open ahead of its launch in India,2022-05-05
Hyundai Creta Knight Edition and 1.5 petrol IMT launched,2022-05-04
"Jeep Meridian production underway, bookings open",2022-05-04
Tata Nexon EV long range launch on May 11,2022-05-04
Volkswagen Taigun gets more features as standard and a price hike,2022-05-04
Honda City e:HEV hybrid launched at Rs 19.50 lakh,2022-05-04
"Honda City e:HEV review, first drive",2022-05-02
"Jeep Meridian review, first drive",2022-05-01
Suzuki V-Strom SX ADV launched in India at Rs 2.12 lakh,2022-04-07
"2022 Maruti Suzuki Ertiga teased, pre-bookings open",2022-04-07
Tata Curvv electric SUV concept unveiled,2022-04-06
Volkswagen bids adieu to the Polo after 12 years with Legend limited edition,2022-04-04
"2022 Renault Kiger launched with exterior updates, new colour and added features",2022-04-01
Volkswagen Virtus production commences,2022-03-31
"2022 MG ZS EV review, first drive",2022-03-31
Ferrari Purosangue teased: Prancing horse SUV will debut this year,2022-03-30
"Tata Altroz DCA review, first drive",2022-03-30
"Jeep Meridian India launch in June 2022, everything you need to know",2022-03-29
JK Tyre Himalayan Drive 8 flagged-off with ceremonial celebration,2022-03-24
Royal Enfield 650 twins 120th Anniversary Edition deliveries commence,2022-03-23
Maserati's new Grecale SUV breaks cover,2022-03-23
"2022 Maruti Suzuki Baleno bookings cross 50,000 mark",2022-03-22
Aston Martin shows off Valkyrie AMR Pro at F1 Bahrain GP,2022-03-22
Tata launches Altroz with dual-clutch automatic transmission,2022-03-21
World Car Awards 2022 top three finalists announced,2022-03-19
Have you downloaded AUTO TODAY March 2022 issue yet?,2022-03-16
Ducati launches special edition Panigale V2,2022-03-16
"2022 Toyota Glanza launched, price starts from Rs 6.39 lakh",2022-03-15
New 2022 Lexus NX 350h launched in India at Rs 64.9 lakh,2022-03-15
2022 Renault Kwid launched at Rs 4.50 lakh,2022-03-15
"Royal Enfield Scram 411 launched: Price, features, details",2022-03-15
"Royal Enfield Scram 411 review, first ride",2022-03-15
Maruti Suzuki Dzire CNG launched at Rs 8.14 lakh,2022-03-10
2022 BMW X4 launched in India at Rs 70.50 lakh,2022-03-11
Audi e-tron wins 2022 Green Car Award by ICOTY,2022-03-10
Mercedes-Benz S-Class wins Premium Car Award 2022 by ICOTY,2022-03-10
TVS Raider wins Indian Motorcycle of the Year 2022 title,2022-03-10
Mahindra XUV700 is the Indian Car of the Year 2022,2022-03-10
"Volkswagen Virtus unveiled, bookings open",2022-03-08
2022 MG ZS EV launched at Rs 22 lakh,2022-03-07
"Skoda Slavia 1.5-litre TSI review, first drive",2022-03-03
Tata Altroz petrol automatic bookings open - 1.2 petrol with dual clutch automatic,2022-03-02
"First-ever Jeep electric SUV showcased, will enter production in 2023",2022-03-02
New 2022 MG ZS EV launch on March 7,2022-03-01
"Hyundai India domestic sales February 2022 - 44,050 units",2022-03-01
2022 Ford Everest (Ford Endeavour) unveiled,2022-03-01
Tata Nexon gets new variants and a new colour option to mark roll-out of 3 lakh units,2022-02-28
Kia India ramps up Anantapur plant's production capacity to produce 3 lakh units annually,2022-02-28
2022 Jeep Compass Trailhawk launched at Rs 30.72 lakh,2022-02-28
"Skoda Slavia 1.0-litre TSI review, first drive",2022-02-28
Skoda Slavia 1.0 TSI launched; price starts from Rs 10.69 lakh,2022-02-28
MG ZS EV owners can now charge their car for free at Fortum Charge & Drive stations,2022-02-27
"Tork Kratos R review, first ride",2022-02-26
2022 Maruti Suzuki WagonR launched at Rs 5.40 lakh,2022-02-26
2022 BMW X4 pre-launch bookings open in India,2022-02-25
"New Jeep Grand Cherokee India launch in 2022, will be assembled locally",2022-02-25
2022 Jeep Compass Trailhawk India launch in March,2022-02-25
Solis Yanmar YM3 series tractors launched in India,2022-02-25
All-electric Mini Cooper SE launched in India,2022-02-24
"Kia India crosses 5 lakh dispatches - 4 lakh domestic, 1 lakh exports",2022-02-24
Jeep Meridian three-row SUV for India unveiled,2022-02-25
"Volkswagen Virtus name confirmed for upcoming sedan, teased ahead of world premiere",2022-02-24
"Tata Punch, Nexon, Harrier and Safari Kaziranga edition launched",2022-02-24
India's first all-women supercar club - Queens Drive Club by Big Boy Toyz,2022-02-24
2022 Maruti Suzuki Baleno launched at Rs 6.35 lakh to Rs 9.49 lakh,2022-02-23
2022 Lexus NX India launch on March 9,2022-02-23
Continental Tires launches new CrossContact AX6 tyres for SUVs in India,2022-02-22
Honda Cars India appoints Takuya Tsumura as CEO and President,2022-02-22
Great India Drive ft. Hyundai Alcazar Part 2 - Bee Talk,2022-02-22
Great India Drive ft. Hyundai Alcazar Part 1 - Vibe Check,2022-02-22
Renault Triber Limited Edition launched to celebrate 1 lakh sales milestone,2022-02-21
2022 Maruti Suzuki Baleno launch on February 23,2022-02-21
Mercedes-AMG EQE 43 and EQE 53 unveiled,2022-02-20
"Bajaj Chetak electric scooter now available in New Delhi, Mumbai and Goa",2022-02-18
Arjun Maini signs for HRT for his second season in DTM,2022-02-17
New Volkswagen sedan for Indian market to be unveiled on March 8,2022-02-17
2022 BMW X3 diesel launched at Rs 65.60 lakh,2022-02-17
Tata Safari Adventure Persona now available in Orcus White colour,2022-02-16
Made in India Volkswagen T-Cross exports underway,2022-02-16
Renault Kiger gets 4-star Global NCAP safety rating,2022-02-17
