Headline,Date
EICMA 2021: Kawsaki Ninja H2 SX SE with radar assisted safety,2021-11-24
EICMA 2021: Updated Honda CBR1000RR-R unveiled: New limited edition SP announced,2021-11-24
"Hero Electric records 24,000-unit sales during festive season",2021-11-24
Simple Energy raises $21 million in oversubscribed pre-series funding round,2021-11-24
EICMA 2021: 2022 Honda ADV350 scooter breaks cover,2021-11-24
EICMA 2021: Vespa Elettrica gets the (Red) treatment,2021-11-24
EICMA 2021: Yamaha showcases the Yamaha MT 10 and MT 10 SP,2021-11-24
EICMA 2021: The Benelli TRK 800 shows up,2021-11-24
2022 Suzuki Katana revealed at EICMA 2021,2021-11-23
Royal Enfield Interceptor and Continental GT 650 120th year editions up for grabs,2021-11-23
Royal Enfield SG650 revealed at EICMA 2021,2021-11-23
India-bound Toyota Belta revealed in Egypt,2021-11-22
2021 LA Auto Show: Kia EV9 all-electric SUV concept takes centre stage,2021-11-22
"Skoda Slavia sedan: First impressions on Maruti Suzuki Ciaz, Hyundai Verna rival",2021-11-22
Formula E: Mahindra Racing reveals M7Electro race car for season 8,2021-11-19
"Mercedes-AMG A 45 S  review, first drive",2021-11-19
"Skoda Slavia unveiled, pre-bookings open",2021-11-18
Skoda Slavia sedan to be unveiled tomorrow,2021-11-17
Ducati Streetfighter V2 debuts with mechanics inherited from Panigale V2,2021-11-17
"F1: Guanyu Zhou joins Alfa Romeo Racing Orlen for 2022 season, to pair with Valtteri Bottas",2021-11-17
2022 Honda Navi Minimoto debuts in North America market,2021-11-17
Mercedes-AMG A 45 S India launch this week: What we know so far,2021-11-17
Nissan Magnite: Magnetic Magnite,2021-11-16
2021 Skoda Karoq exterior design sketches teased ahead of global debut this month,2021-11-16
"Abu Dhabi Dessert Challenge, stage 5: Hero MotoSports' Joaquim Rodrigues clinches podium",2021-11-15
Porsche Taycan electric car first look review,2021-11-12
"New Honda SUV RS Concept debuts, will rival Hyundai Creta, Kia Seltos in India",2021-11-11
2022 Hyundai Creta facelift breaks cover at 2021 Indonesia Auto Show,2021-11-11
"Abu Dhabi Desert Challenge, stage 3: Hero MotoSports' Joaquim Rodrigues registers top 5 finish",2021-11-10
2022 Dakar Rally: MotoGP rider Danilo Petrucci to race in KTM colors,2021-11-10
2022 Indian National Rally Championship calender announced,2021-11-10
Magenta ChargeGrid installs six charging hubs for electric commercial vehicles in Bengaluru,2021-11-10
Mahindra XUV700 receives 5-star rating in latest Global NCAP crash test results,2021-11-10
Mahindra Logistics acquires Meru Cabs,2021-11-10
"2022 Maruti Suzuki Vitara Brezza spotted testing, launch next year",2021-11-09
"2022 Hyundai Creta exterior, interior images leaked ahead of global debut on November 11",2021-11-09
Battery Smart raises $7 million in pre-series A round,2021-11-09
Skoda Slavia interior design sketch released ahead of India debut this month,2021-11-09
"Abu Dhabi Desert Challenge, stage 2: Sebastian Buhler, Joaquim Rodrigues break into top 10 ranking",2021-11-09
TVS Motor Company Chairman Venu Srinivasan conferred with Padma Bhushan award,2021-11-09
2021 Audi Q5 facelift India launch date revealed,2021-11-09
New Maruti Suzuki Celerio launch this week: What we know so far,2021-11-09
2021 Honda Civic scores 5-star rating in latest ASEAN NCAP crash test results,2021-11-08
"Abu Dhabi Desert Challenge, stage 1: Hero MotoSports break into top 10",2021-11-08
"NREDCAP, RACEnergy inaugurate first electric vehicle hot-swap station in Tirupati",2021-11-08
Mountain Lore ft. Hyundai i20 - Magnificent India,2021-11-08
BSES partners with eVolt to set up charging stations across Delhi,2021-11-03
Honda resumes hunt for next-generation Indian rider,2021-11-03
Formula E: Tata Consultancy Services join Jaguar Racing as title partner ahead of 2022 season,2021-11-03
"2022 Audi A8 debuts with sharper styling, enhanced interior, added tech",2021-11-03
"October 2021 tractor sales in India: Sonalika registers overall sales of 17,130 units",2021-11-03
"October 2021 two-wheeler sales in India: EV maker WardWizard sells 2,855 units of Joy e-bikes",2021-11-02
Diwali car discounts 2021: Hyundai India offers benefits up to Rs 1.5 lakh,2021-11-02
October 2021 car sales in India: Volkswagen India rides high on Taigun demand,2021-11-02
Skoda Slavia exterior design sketches revealed ahead of global debut this month,2021-11-02
New Maruti Suzuki Celerio pre-bookings open in India ahead of launch this month,2021-11-02
"October 2021 car sales in India: Kia India registers domestic sales of 16,331 units",2021-11-01
October 2021 car sales in India: Maruti Suzuki domestic sales drop,2021-11-01
Made-in-India Maruti Suzuki Baleno scores zero stars in latest Latin NCAP crash test results,2021-11-01
"Two-wheeler sales in India: Hero Electric sold 50,331 units till now",2021-11-01
"October 2021 two-wheeler sales in India: TVS registers sales of 3,55,033 units",2021-11-01
"October 2021 car sales in India: MG Motor retails 2,863 units",2021-11-01
"2022 Ducati Multistrada V4 Pikes Peak debuts with new styling, enhanced features, and more power",2021-11-01
MG Astor- 'ASTOR'naut in the ocean,2021-11-01
FMSCI's Women in Motorsport commission urges for more women participation,2021-11-01
Skoda Slavia - Breathing life into the sedan,2021-10-30
2022 Mercedes-AMG SL breaks cover,2021-10-29
Honda announces battery sharing service for electric rickshaws in India,2021-10-29
"Tata Motors, BluSmart Mobility join hands to expand its electric fleet in Delhi-NCR",2021-10-29
MINI Cooper SE electric bookings open in India ahead of launch,2021-10-29
Audi Q9 7-seater SUV spotted at Nürburgring,2021-10-28
Have you downloaded AUTO TODAY 6th Anniversary issue yet?,2021-10-28
2022 Hyundai Creta facelift teased ahead of global debut next month,2021-10-28
This custom-made Royal Enfield Starship Meteor 350 is inspired from Star Wars,2021-10-28
Porsche Taycan Electric India launch details revealed,2021-10-28
Japan start-up unveils world's first hoverbike priced at Rs 5.1 crore,2021-10-28
"New Range Rover breaks cover, India-bound by 2022",2021-10-27
Komaki teases new electric cruiser ahead of launch next year,2021-10-26
Harman introduces new Infinity REF 7005A amplifier and Alpha 100 multimedia player,2021-10-26
"REVOS introduces peer-to-peer charging network, aims to install one million charging points in India",2021-10-26
Honda Cars India partners with Bank of Maharashtra to offer financing schemes,2021-10-26
"Kazam, BSES to install electric vehicle charging stations in Delhi",2021-10-26
New Range Rover plug-in hybrid caught testing ahead of debut early next year,2021-10-26
Ducati will be sole supplier of motorcycles for MotoE World Cup from 2023,2021-10-26
Emilia Romagna MotoGP: Marc Marquez wins as Yamaha's Fabio Quartararo seals championship,2021-10-25
Mahindra First Choice aims to launch 20 refurbished vehicle stores by 2022,2021-10-25
Boys and Machines aims to clock revenues worth Rs 65 crore by March 2022,2021-10-25
"Tata Power installs more than 1,000 EV charging stations in India",2021-10-25
"Enigma Automobiles introduces new electric motorcycle, open bookings",2021-10-25
MINI Cooper Electric teased ahead of India launch,2021-10-25
"Hero Electric targets stronger sales, 1000 touchpoints by 2022",2021-10-25
"2022 Hyundai Creta facelift exterior, interior design sketches revealed",2021-10-22
Mercedes-Benz India launches new customer-centric sales model,2021-10-22
MG Astor SUV sold out for 2021 in India,2021-10-21
Volvo XC40 Recharge electric compact SUV coming to India next year,2021-10-21
Ducati Scrambler 1100 Tribute PRO and Ducati Scrambler Urban Motard revealed at Ducati World Premiere,2021-10-20
"Mahindra XUV700 registers 65,000 bookings within 14 days",2021-10-20
Honda Cars India introduces cabin air-filter on all models,2021-10-20
Maserati Grecale global debut postponed to 2022,2021-10-20
Foxconn previews three electric vehicle prototypes,2021-10-20
Royal Enfield to introduce limited-edition helmets,2021-10-19
2021 Audi Q5 facelift India bookings open ahead of launch this month,2021-10-19
"Tesla Model 3 India review, first look",2021-10-16
Kawasaki to electrify entire range by 2035,2021-10-14
Royal Enfield will attempt a ride to the South Pole,2021-10-14
Tata Punch achieves 5-star rating in latest Global NCAP crash test results,2021-10-14
Revolt RV400 electric motorcycle bookings to reopen on October 21,2021-10-14
"TVS roll out 1 lakh units of BMW G 310 R, BMW 310 GS from Hosur plant",2021-10-14
Tata Punch to be launched in India on October 18,2021-10-13
New Mahindra Scorpio spotted in production-ready avatar,2021-10-13
"Volvo to update XC60, S90 with hybrid powertrains in India, launch this month",2021-10-13
Bajaj Pulsar 250 India launch details announced,2021-10-13
"2021 Rallye Du Maroc, round 4: Hero MotoSports Joaquim Rodrigues moves in to top 10",2021-10-13
Tata Motors to launch 10 new EVs in next five years,2021-10-13
Tata Motors raises $1 billion for its electric vehicle business,2021-10-12
Citroen C3 premium hatchback spied ahead of India debut next year,2021-10-12
2021 Audi Q5 local production begins ahead of India launch,2021-10-12
"2021 Rallye Du Maroc, round 3: Hero MotoSports' registers impressive performance",2021-10-12
Skoda Slavia spotted in a special camouflage wrap ahead of India reveal,2021-10-11
"2021 INMRC, round 3: Rajiv Sethu grabs podium for IDEMITSU Honda SK69 Racing",2021-10-11
"2021 Rallye Du Maroc, round 2: Hero MotoSports progress with mixed results",2021-10-11
MG Astor India pre-bookings to open on October 21,2021-10-11
India-based EMotorad showcases electric bikes at Dubai Expo 2020,2021-10-11
"Tata Punch review, first drive",2021-10-09
"Conclave 2021: Speed limit on highways should be increased to 140kmph, says Nitin Gadkari",2021-10-08
"India Today Conclave 2021: Tesla should price its vehicles at Rs 35 lakh in India, says Nitin Gadkari",2021-10-08
2021 MG ZS EV facelift debuts for UK market with 439km range,2021-10-07
"New Skoda Slavia compact sedan confirmed for India, launch later this year",2021-10-07
"Mahindra XUV700 registers 25,000 pre-bookings in under an hour",2021-10-07
MG Astor India launch next week,2021-10-07
"October 2021 car discounts: Big offers on Honda City, WR-V, Jazz, Amaze",2021-10-07
New TVS 125cc scooter to be launched in India this week,2021-10-06
"October 2021 car discounts: Festive season offers on Hyundai Kona Electric, i20, Grand i10 Nios, Santro",2021-10-06
Exicom will supply new lithium-ion battery to Omega's electric L5 cargo vehicles,2021-10-06
Mercedes-Benz India clocks its highest-ever domestic sales,2021-10-06
New Maruti Suzuki Celerio spied ahead of India launch next month,2021-10-06
"October 2021 car discounts: Huge benefits on Tata Harrier, Nexon EV, Tigor, Tiago",2021-10-06
Jeep Meridian 7-seater SUV spotted with heavy camouflage ahead of launch next year,2021-10-06
New Skoda Superb spotted in Austria sporting new design elements,2021-10-05
"Hero Xpulse 200 4V teased, launch this month",2021-10-05
"September 2021 car sales: Nissan India retails overall 8,716 units",2021-10-05
Triumph Tiger Sport 660 breaks cover,2021-10-05
Honda Two Wheelers registers 5 crore domestic unit sales,2021-10-05
"TVS, Tata Power to build electric two-wheeler charging eco-system in India",2021-10-05
Tata Punch: Variants on the youngest SUV explained,2021-10-04
Tata Punch unveiled in India,2021-10-04
"September 2021 car sales: Kia India registers 14,441 units in domestic market",2021-10-04
"2021 Land Rover Defender 90 review, first drive",2021-10-02
"Triumph Tiger 1200 is almost production ready, new images revealed",2021-10-02
"September 2021 car sales: Honda Cars India registers 6,765 units in domestic market",2021-10-02
September 2021 two-wheeler sales: Royal Enfield registers 44 per cent drop in sales,2021-10-02
"2021 Mercedes-Benz S-Class to be locally assembled, launch this month",2021-10-01
"September 2021 car sales: Skoda Auto India clocks 3,027 units",2021-10-01
Tata Punch pre-bookings to officially open this month,2021-10-01
Tata Safari Gold Edition: Tata's festive season punch,2021-10-01
September 2021 car sales: MG Motor India registers 28 per cent increase,2021-10-01
September 2021 car sales: Maruti Suzuki sales tumble due to shortage of electronic components,2021-10-01
"MG Astor launch this month: What to expect from Hyundai Creta, Kia Seltos rival",2021-10-01
"Komaki XGT-X1 electric scooter with lead-acid battery launched in India at Rs 45,000",2021-09-30
Maserati Grecale Trofeo snapped ahead of world debut,2021-09-30
ABB introduces world's fastest electric car charger in Europe,2021-09-30
JK Tyre backed FMSCI Indian National Regularity Run Championship to start this year,2021-09-30
Honda to integrate Google's in-vehicle connected service in future models,2021-09-30
Rolls-Royce Spectre all-electric car to debut in 2023,2021-09-29
"2022 Jeep Grand Cherokee arrives with new exterior, interior, and hybrid power",2021-09-29
Tata Punch pre-bookings open unofficially ahead of launch next month,2021-09-29
"Mahindra XUV700 prices, variants leaked ahead of launch next month",2021-09-29
Kia rebrands UVO Connect to Kia Connect in Europe,2021-09-29
"Ford to invest $11.4 billion in new plant, build electric vehicles",2021-09-29
Triumph Tiger Sport 660 to debut on October 5,2021-09-29
"2022 Kawasaki Ninja 125, Z125 receive new colors",2021-09-29
Tata Safari receive new features on select variants,2021-09-29
MG Astor variants leaked ahead of launch,2021-09-29
Tata Altroz clocks 1 lakh unit production milestone,2021-09-29
F2: Jehan Daruvala continues strong form with podium at Sochi,2021-09-28
Toyota Yaris sedan discontinued in India,2021-09-27
eBikeGo to install one lakh IoT enabled smart charging stations across India,2021-09-27
"goEgoNetwork installs world's highest EV charging station at Kaza, Spiti Valley",2021-09-27
Nissan India introduces virtual sales advisor for Nissan Magnite,2021-09-25
2022 Jeep Grand Cherokee two-row SUV to debut this month,2021-09-25
"2022 Suzuki GSX-S1000GT makes global debut, India launch next year",2021-09-25
Tata Xpres-T electric sedan: All you need to know,2021-09-25
"Tata Motors clocks 10,000 EV sales milestone",2021-09-25
Ducati Scrambler DesertX teased ahead of global debut in December,2021-09-24
Ford India exit: FADA urges government to monitor dealer compensation plan,2021-09-24
GM reveals new motor to power its future EVs,2021-09-24
Tata Punch full details to be revealed next month,2021-09-24
"Hero Electric to set up 10,000 EV charging stations across India",2021-09-24
Maserati Grecale SUV to debut in November,2021-09-23
Triumph Tiger 900 Bond Edition pays tribute to 007,2021-09-23
"2020 Mahindra Thar price announced, get all the details here",2020-10-02
2021 Triumph Trident unveiled: A closer look at Triumph's new 660cc Roadster,2020-10-30
Volkswagen Taigun: What we know so far,2021-09-22
"Dakar Rally 2022: Toyota reveals driver's line-up, prototype rally car",2021-09-22
"Renault Kiger, Volkswagen Taigun, Audi e-tron GT feature in 2022 World Car Awards",2021-09-22
"New Honda BR-V 7-seater SUV debuts with new design, advanced features",2021-09-22
"Ola Electric clock bookings worth Rs 1,100 crore in first two days of online purchase",2021-09-22
Omega Seiki Mobility introduces its first electric small commercial vehicle,2021-09-22
Tata Punch mini-SUV interior teased ahead of launch,2021-09-22
Mahindra XUV700 stays connected with India Today app on new AdrenoX system,2021-09-21
"EVRE, Park+ to set up 10,000 EV charging stations in India by 2023",2021-09-21
"Skoda Kushaq receives 10,000 bookings since launch",2021-09-20
"2021 Ducati Monster India launch details revealed, bookings underway",2021-09-20
"Citroen C3: Design, features, specifications, rivals, prices, and other details",2021-09-20
"2022 Toyota Tundra debuts with new styling, hybrid power, and modern features",2021-09-20
"MG Astor SUV: First look of Hyundai Creta, Kia Seltos rival",2021-09-19
Upcoming Tata Punch spotted in new brown shade ahead of launch,2021-09-18
TVS buys majority stake in e-bike brand EGO Movement,2021-09-17
Have you downloaded AUTO TODAY September 2021 issue yet?,2021-09-17
Aventose Energy to launch new S110 electric scooter in India next month,2021-09-17
New Triumph Tiger 1200 will get T-Plane crank advantage,2021-09-17
Citroen C3 unveiled; India launch in first half of 2022,2021-09-16
"2022 Ford Fiesta debuts with new design, enhanced features and more power",2021-09-16
New TVS 125cc motorcycle: What to expect,2021-09-16
"Cabinet clears Rs 26,000 crore PLI scheme for auto sector to boost electric car production",2021-09-15
India-bound Citroen CC21 subcompact SUV teased ahead of global debut,2021-09-15
MG Astor SUV bookings to open this week,2021-09-15
"Ola electric scooter price, booking online, official website and  key features",2021-09-15
New Nissan GT-R unveiled for Japan,2021-09-15
MG Astor SUV unveiled ahead of India launch next month,2021-09-15
"New Force Gurkha revealed in India, price announcement later this month",2021-09-15
New Triumph Speed Triple 1200 RR breaks cover,2021-09-15
Ford India exit: What's on the cards for employees and dealers,2021-09-14
MG Astor SUV: What we know so far,2021-09-14
"September 2021 car discount offers: Huge offers on Maruti Suzuki S-Cross, Ciaz, Baleno, Vitara Brezza, Swift",2021-09-14
New TVS  125cc motorcycle teased ahead of debut,2021-09-14
India-only Skoda Slavia sedan spotted in Austrian Alps ahead of launch,2021-09-14
Kia Sonet registers one lakh sales since launch last year,2021-09-14
"Maharashtra EV policy 2021 comes in to effect, prices of EVs to drop",2021-09-14
Skoda Auto India to have 30 compact workshops by end of 2021,2021-09-14
"September 2021 car discount offers: Huge discounts on Hyundai Kona EV, i20, Grand i10 Nios, Santro",2021-09-13
"Ola Futurefactory to employ over 10,000 women, will be world's largest women-only factory",2021-09-13
"EV Policy 2021: Ather 450 Plus price slashed by Rs 24,000 in Maharashtra",2021-09-13
MG Astor SUV India reveal date announced,2021-09-13
"September 2021 car discount offers: Massive concession on Tata Safari, Harrier, Nexon, Tigor, Tiago",2021-09-13
"2021 INMRC: IDEMITSU Honda SK 69, Talent Cup, Hornet 2.0 One Make Race results",2021-09-13
"September 2021 car discount offers: Huge benefits on Mahindra XUV500, Bolero, Marazzo, Scorpio",2021-09-13
"F2: Jehan Daruvala clinches win at Monza sprint race, finishes P5 in feature race",2021-09-13
FADA requests for franchise protection bill after Ford India exit,2021-09-09
Ford Mustang Mach-E electric SUV confirmed for India launch,2021-09-09
"Ford shuts down India operations, to focus on niche products",2021-09-09
"World EV Day 2021: India has come a long way in EV transition since 2015, says CESL",2021-09-09
2021 IAA: Kia showcases European Sportage with hybrid tech,2021-09-09
Ola electric scooters online purchase postponed after website faces technical glitch,2021-09-09
Mahindra Racing announces drivers' line-up for 2022 Formula E season,2021-09-08
2021 IAA: Polestar reveals limited edition electric bike,2021-09-08
"Audi e-Tron GT, RS e-Tron GT bookings open in India ahead of launch",2021-09-08
Ola electric scooters go on sale today,2021-09-08
"Hyundai bets on hydrogen-based vehicles, announces Hydrogen Vision 2040",2021-09-08
"Tata Tigor EV review, first drive",2021-09-08
New Triumph Speed Triple 1200 RR teased ahead of global debut this month,2021-09-07
2021 IAA: Dacia Jogger 7-seater SUV unveiled,2021-09-07
2021 IAA: BMW Motorrad unveils Vision Amby concept electric bicycle with 300km range,2021-09-07
EV Plugs India introduces app to locate electric car charging stations,2021-09-07
"Lumax, Alps Alpine joint venture unveils premium car audio range for India",2021-09-07
Honda CB200X deliveries commence in India,2021-09-07
2021 IAA: Renault showcases Mégane E-Tech Electric,2021-09-06
2021 IAA: Mercedes-Benz EQG Concept is an electric G-Wagon in the making,2021-09-06
"2021 DTM Championship, round 5: Arjun Maini registers points at Red Bull Ring",2021-09-06
"Baja SAE India 2022 dates announced, 15th edition to start this month",2021-09-03
"2022 BMW G310 GS to receive new paint scheme, India launch soon",2021-09-03
Nissan to launch electric car for Japan in 2022,2021-09-03
"Honda updates CB500F, CBR500R and CB500X with engine, chassis upgrade",2021-09-03
"Maruti Suzuki recalls 1,81,754 units of Ciaz, Ertiga, Vitara Brezza, S-Cross and XL6. Here's why",2021-09-03
Upcoming Hyundai Casper mini-SUV spied in production guise ahead of global debut this year,2021-09-03
Audi Grandsphere electric concept is a luxurious private jet for the road,2021-09-03
2022 Kia Sportage SUV debuts in Europe,2021-09-03
Everrati electrifies Land Rover Series IIA,2021-09-02
"Land Rover Defender V8 Bond Edition revealed, celebrates 25th James Bond film",2021-09-02
Triumph Tiger 1200 prototype enters final development stage,2021-09-02
"August 2021 car sales: Tata Motors retails 54,190 units",2021-09-02
"August 2021 car sales: Honda Cars India registers 11,177 units",2021-09-02
"August 2021 car sales: Skoda Auto India sells 3,829 units",2021-09-02
August 2021 two-wheeler sales: Honda registers 18 per cent growth,2021-09-02
Brand new KTM RC 390 revealed,2021-09-01
CEAT partners with Royal Enfield as tyre supplier for the new Classic 350,2021-09-01
Mercedes-AMG joins hybrid bandwagon with GT 63 S E Performance,2021-09-01
Power Global introduces eZee swappable batteries for auto-rickshaws,2021-09-01
"August 2021 sales: Kia India clocks 16,750 units",2021-09-01
"August 2021 sales: MG Motor retails 4,315 units",2021-09-01
"India-bound Hyundai Casper exterior design revealed, will rival Tata Punch mini-SUV",2021-09-01
HOP Electric Mobility to set up second manufacturing facility in India,2021-09-01
"2021 Royal Enfield Classic 350 first ride, review",2021-09-01
Volkswagen India announces price hike on Polo and Vento,2021-09-01
2021 TVS Apache RR 310 built to order: Explained,2021-08-31
New Royal Enfield Classic 350: What we know so far,2021-08-31
Tata Tigor EV scores four star rating in latest Global NCAP crash test results,2021-08-31
Three-row Land Rover Defender 130 makes spy shot debut,2021-08-31
Tata Tigor EV India launch today: What we know so far,2021-08-31
MG Motor India to honor Paralympics silver medalist Bhavina Patel with a customized MG SUV,2021-08-30
"2022 Honda Africa Twin, Africa Twin Adventure Sport revealed with new color and graphic updates",2021-08-30
New Force Gurkha to launch in India on September 15,2021-08-30
Renault India honors Tokyo Olympics 2020 flagbearer MC Mary Kom; gifts her Kiger compact SUV,2021-08-30
2021 TVS Apache RR 310: What we know so far,2021-08-30
MORTH introduces new Bharat series registration mark for new vehicle,2021-08-28
Force Motors India teases new Gurkha ahead of launch next month,2021-08-28
Taj Mahal ft. Hyundai Creta - Magnificent India,2021-08-27
2021 Ducati SuperSport 950 to launch in India next month,2021-08-27
India-bound 2022 Jeep Commander three-row SUV revealed for Brazil,2021-08-27
2022 Jeep Grand Cherokee two-row SUV spied sans camouflage,2021-08-27
Genesis GV60 electric crossover debuts on new EV platform,2021-08-27
Arjuna Awardee Deepa Malik to voice personal AI assistant in MG Astor,2021-08-26
KTM India commemorates 10th anniversary with special offers,2021-08-26
Tata Motors felicitates Indian Olympic athletes with Tata Altroz,2021-08-26
Sun Mobility introduces mobility as a service solution,2021-08-26
"Audi to focus strictly on EVs, phase out internal combustion powered vehicles by 2033",2021-08-26
Kia Seltos X Line: All the details here,2021-08-26
2021 TVS Apache RR 310 India launch details revealed,2021-08-26
2021 Triumph Speed Twin India launch details revealed,2021-08-25
"INMRC 2021, Round 1: Double wins for Rajini Krishnan, Jagan Kumar",2021-08-25
"Triumph Tiger Sport 660 prototype revealed, India launch in early 2022",2021-08-25
"2021 Honda Amaze review, first drive",2021-08-25
Hyundai i20 N Line: All you need to know,2021-08-25
New Royal Enfield Classic 350 India launch details announced,2021-08-24
Volkswagen Taigun India launch next month,2021-08-24
Kia Seltos X-Line: What we know so far,2021-08-24
Simple Energy to raise $100 million in Series A funding,2021-08-24
Arjun Maini scores first points in DTM championship,2021-08-24
Hyundai i20 N Line India launch details revealed,2021-08-24
"Hyundai i20 N Line debuts in India, bookings open now",2021-08-24
Tata Punch mini-SUV: What we know so far,2021-08-23
Tata Punch mini-SUV revealed ahead of launch later this year,2021-08-23
Nissan Z returns with more power under its belt,2021-08-21
"Formula Regional Indian Championship formally announced, to feature Hyderabad street circuit",2021-08-21
Kia Seltos registers 2 lakh sales since launch,2021-08-21
World Car Awards' add new electric vehicle category for 2022,2021-08-21
"Honda announces riders' line-up for 2021 INMRC, Talent Cup",2021-08-20
Bugatti Chiron Super Sport and Bolide debut at Monterey Car Week 2021,2021-08-20
"Sonalika introduces app for farmers, enables renting farm equipment, services",2021-08-20
MG Motor India introduces new AI assistant with enhanced in-car connectivity features,2021-08-18
MG Motor India to introduce CAAP software with upcoming MG Astor SUV: Details,2021-08-18
"Tata Tigor EV revealed in India, launch on August 31",2021-08-18
"Hyundai N Line brand to debut in India this month, first model could be Hyundai i20 N",2021-08-17
New Tata Tigor EV unveil on August 18,2021-08-17
Audi Skysphere is a shape-shifting concept EV with ultra-modern looks,2021-08-16
