Headline,Date
"Simple One electric scooter: Price, range, top speed, battery, motor, bookings, features, all other details",2021-08-16
Tata Motors ties up with Bank of Maharashtra to offer finance options on PV range,2021-08-16
Ola electric scooter variants explained,2021-08-16
Mahindra inaugurates new SUV proving track in Tamil Nadu,2021-08-15
Ola's first electric scooter rolls out from its Chennai FutureFactory ahead of debut today,2021-08-15
Mahindra XUV700 SUV breaks cover,2021-08-14
Lamborghini Countach returns as a V12 hybrid supercar limited to just 112 units,2021-08-13
Maruti Suzuki Vitara Brezza CNG to be launched soon in India,2021-08-13
PM Narendra Modi launches national vehicle scrappage policy,2021-08-13
"Unfit, polluting vehicles to be phased out: PM Modi launches scrappage policy",2021-08-13
Zypp Electric launches its services in Bengaluru and Pune,2021-08-13
"14,000 MG Hector SUVs to be recalled, here is the reason",2021-08-11
Lamborghini Urus Graphite Capsule India launch soon,2021-08-11
Nissan targets 40 per cent sales to be electric by 2030 of U.S.,2021-08-11
"Motorsport: Raaj Bakhru, Raiden Samervel win IndiKarting Clash of Pros",2021-08-11
Audi RS Q e-tron put through its paces ahead of 2022 Dakar Rally debut,2021-08-11
"Tata Tigor EV launch soon in India, here are important details you should know",2021-08-11
Mahindra XUV700 debut date officially revealed,2021-08-11
"2021 BMW 5 Series review, first drive",2021-08-10
MG Motor to introduce new MG Hector SUV variant in India,2021-08-10
Tata Tiago NRG facelift: First look,2021-08-10
Pawan Munjal teases upcoming Hero electric scooter,2021-08-10
AUTO TODAY August 2021 issue now available for FREE DOWNLOAD,2021-08-09
"Mahindra Bolero Neo garners 5,500+ bookings since launch in India",2021-08-09
"Mahindra reveals new logo, to debut with Mahindra XUV700 SUV",2021-08-09
"Hyundai confirms N Line for India, to debut later this year",2021-08-09
"Volkswagen Taigun review, first drive",2021-08-09
"Ola Electric scooter receiving bookings from across India, launch on August 15",2021-08-06
Omega Seiki unveils two electric scooters ahead of festive season launch,2021-08-06
"Sonalika registers 10,756 overall tractor sales in July 2021",2021-08-06
"Electric vehicles exempted from registration certificate fees in India, says MoRTH",2021-08-06
Kia India becomes fastest carmaker to achieve sales milestone of 3 lakh units,2021-08-06
"New Honda Amaze facelift production starts, launch in India on August 18",2021-08-05
Benelli India opens new showroom in Kerala,2021-08-04
"Ola Electric scooter launch in India on August 15, get all important details here",2021-08-04
"New Honda Amaze facelift launch in India on August 18, bookings open now",2021-08-04
Suzuki Motorcycle India sales in July 2021: Company records 112 per cent rise in total sales,2021-08-03
Honda 2Wheelers India sales in July 2021: Total sales rise 20 per cent,2021-08-03
Hyundai sales in July 2021: Carmaker posts 46 per cent cumulative growth,2021-08-03
MG Motor India sales in July 2021: Automaker registers 101 per cent jump,2021-08-02
Royal Enfield sales in July 2021: Company records 9 per cent growth,2021-08-02
Renault India commence exports of Made in India Kiger to South Africa,2021-08-02
Stellantis announces new brand heads for Citroen and Jeep in India,2021-08-02
Mahindra XUV700 spied undisguised ahead of debut later this year,2021-08-02
Auto Expo 2022 postponed due to Covid-19 pandemic,2021-08-02
"2021 Mercedes-AMG E 53 review, first drive",2021-07-31
Toyota Innova Crysta price to increase from August 1,2021-07-30
"CityAirbus flying car takes off at maximum weight of 2,310kg, flies at 20m altitude",2021-07-30
BGauss to launch two new electric two-wheelers later this year,2021-07-30
MG One mid-size SUV's exterior details revealed ahead of world premiere,2021-07-29
"Maruti Suzuki reports total sales of 3,53,614 units in Q1 FY 2021-22",2021-07-29
"Kia India partners with ICICI Bank & Yes Bank, introduces new finance schemes for car buyers",2021-07-29
Honda City receives updated version of Google Assistant in India,2021-07-29
2022 BMW X7 facelift with new headlight design spied,2021-07-29
Volkswagen Taigo debuts in Europe as a new SUV coupé,2021-07-29
"Royal Enfield model-wise sales in June 2021: Classic 350 at top; Meteor 350, Bullet 350 make key contributions",2021-07-28
"Benelli 502c launch in India on July 29; expected price, features, specifications, other details",2021-07-28
Hyundai inaugurates new corporate headquarters in Gurugram,2021-07-28
Hyundai India pitches for import duty cut on electric vehicles,2021-07-28
"Top 5 selling scooters in June 2021: Honda Activa, TVS Jupiter, Suzuki Access 125, Honda Dio, Hero Pleasure+",2021-07-28
Volkswagen adds more firepower to Atlas Cross Sport,2021-07-28
Electric two-wheelers may account for 10 per cent of overall sales in 2-3 years: Ather Energy,2021-07-27
"Top 5 selling motorcycles in June 2021: Splendor, HF Deluxe, Shine, Pulsar 125, Platina",2021-07-27
"Skoda Auto to be present in 100+ cities across India from August 2021, to have 170+ customer touchpoints",2021-07-27
2022 Mercedes-Benz SL spied with minimum camouflage,2021-07-27
"Tata Safari reaches production milestone of 10,000 units",2021-07-27
SsangYong release design sketches of new-generation X200 SUV,2021-07-27
"Bajaj Auto, Pierer Mobility reorganize stakes in KTM",2021-07-27
Honda Motorcycle & Scooter India opens new BigWing dealership in Chandigarh,2021-07-26
Tata Tiago NRG facelift launch on August 4,2021-07-26
Skoda Kushaq variant-powertrain combinations explained,2021-07-26
2021 Formula E: Mahindra Racing's Alex Lynn bags podium in London E-Prix,2021-07-26
"No more liquor shops along National and State Highways, says SC",2021-07-26
"Offers up to Rs 22,000 on Honda City, check all details here",2021-07-26
"Honda Amaze facelift launch in August 2021, here are all the details",2021-07-26
Volvo to take full ownership of its manufacturing and sales operations in China,2021-07-23
2022 Jeep Compass mild-hybrid spied sans camouflage,2021-07-23
Mercedes-Benz will be an all-electric brand by 2030,2021-07-22
Ola Electric reveals colors for upcoming electric scooter,2021-07-22
2023 Aston Martin Valhalla revealed with 950bhp hybrid powertrain,2021-07-22
2022 Audi RS 3 revealed for Europe,2021-07-21
2022 BMW CE 04 electric scooter debuts with 128km range,2021-07-21
Have you downloaded AUTO TODAY July 2021 issue yet?,2021-07-20
Volkswagen India showrooms implement new logo,2021-07-20
Gujarat EV Policy: Okinawa to triple its customer base by 2022,2021-07-20
Bajaj Chetak Electric Scooter: Online booking open; where to book and other details,2021-07-20
Sonalika to set up India's largest harvester manufacturing facility in Himachal Pradesh,2021-07-20
"Hyundai Alcazar garners 11,000 bookings in less than a month",2021-07-19
Ola Electric registers 1 lakh reservations for its electric scooter within the first 24 hours of opening bookings,2021-07-19
Sudarshan Venu charts TVS Motor Company's electric road map,2021-07-18
Lamborghini Huracan STO launched in India priced from Rs 4.99 crore,2021-07-17
"MoRTH has formalised registration process of Vintage Motor Vehicles in India, says Nitin Gadkari",2021-07-17
Mahindra Bolero Neo review,2021-07-17
"Ford recalling 7,75,000 SUVs for steering issue linked to six injuries",2021-07-16
"KTM 250 Adventure has limited period discount of Rs 25,000, check out all details",2021-07-16
"Ola Electric scooter bookings open in India, here are all the details",2021-07-16
2021 Tata Dark Editions: Explained in detail,2021-07-15
"Tata Motors model-wise PV sales in June 2021: Nexon, Altroz emerge best-sellers",2021-07-15
"Audi e-tron, e-tron Sportback ownership plans: Get all the details here",2021-07-14
"Tata Xpres brand introduced for fleet customers, Tata Xpres-T EV to be first launch under it",2021-07-14
2021 Harley-Davidson Sportster S unveiled,2021-07-14
Overall domestic vehicle sales rise by nearly 15 per cent in June 2021: SIAM,2021-07-14
Kia India model-wise sales in June 2021: Seltos at top,2021-07-14
2021 Honda Gold Wing Tour deliveries start in India,2021-07-13
Maharashtra Electric Vehicle Policy 2021: EVs to make up 10 per cent of all new vehicle registrations by 2025,2021-07-13
"Maruti Suzuki Swift price hiked, here is updated price list",2021-07-13
"Royal Enfield Meteor 350 price increased, here is latest price list",2021-07-13
"Mahindra Bolero price hiked by over Rs 22,000, here are all details",2021-07-13
"Hyundai Alcazar ahead of MG Hector Plus, Tata Safari, Mahindra XUV500 in June 2021 sales, check out details",2021-07-12
"Royal Enfield Himalayan price hiked, check out the latest price here",2021-07-12
"Audi e-tron to get two variants, e-tron Sportback to be available in one",2021-07-12
"Maruti Suzuki Swift, CNG model prices increased by up to 15,000",2021-07-12
Volvo Car India's retail sales grow 52 per cent in H1 2021,2021-07-09
"Mahindra Scorpio price hiked by up to Rs 38,000, get the details here",2021-07-09
"Ford discontinues Titanium 4X2 variant of Endeavour, SUV's price now starts at Rs 33.80 lakh",2021-07-09
"Royal Enfield Classic 350 price hiked, Dual Channel variant costs over Rs 2 lakh now",2021-07-09
"Royal Enfield Classic 350 price increased, Single Channel variant costs Rs 7,316 more now",2021-07-09
"Benelli 502C pre-bookings open in India, launch soon",2021-07-08
"Ferrari Roma launched in India officially, starts at Rs 3.76 crore",2021-07-08
Overall vehicle retail sales rise 23 per cent in June 2021: FADA,2021-07-08
Mahindra Bolero Neo launch in India on July 15,2021-07-08
HOP Electric Mobility launches India's first integrated battery swapping and charging station network,2021-07-08
TVS Racing announces rookie category at the TVS One Make Championship,2021-07-08
Mercedes-Benz India's retail sales grow 65 per cent in H1 2021,2021-07-08
"Skoda Kushaq garners over 2,000 bookings",2021-07-07
"Bajaj Dominar 250 now cheaper by Rs 16,800, here are all the details",2021-07-07
Benelli 502 C teased: Launching in India soon,2021-07-07
"Top 10 selling cars in June 2021: WagonR, Swift, Baleno, Vitara Brezza, Dzire, Alto, Creta, Ertiga, Eeco, Nios",2021-07-07
Citroën's new factory to home Buy Online initiative: Explained,2021-07-07
Steelbird launches a range of automotive lubricants,2021-07-05
"Tata Safari, Harrier, Nexon, Altroz, Tigor, Tiago: Automaker to soon increase prices of SUVs, cars",2021-07-05
Simple Energy's upcoming electric scooter to be called Simple One,2021-07-05
"Yamaha announces Rs 5,000 cashback offer on Fascino 125 Fi, RayZR 125 Fi scooters for frontline warriors",2021-07-05
Lamborghini Huracan STO India launch details revealed,2021-07-05
Tata Motors teases new Dark Edition for Altroz and Nexon EV ahead of launch,2021-07-05
Mercedes-AMG E 53 4Matic+ and AMG E 63 S 4Matic+ to be launched in India this month,2021-07-04
Ola all set to launch the Ola scooter in India,2021-07-03
"Kia Seltos, Kia Sonet, Kia Carnival: Kia India registers sales of 15,015 units in June 2021",2021-07-02
Hyundai Motor India's domestic wholesales grow 90 per cent in June 2021,2021-07-01
FMSCI nominates Musa Sherif for Khel Ratna Awards,2021-07-01
Maruti Suzuki India's domestic wholesales rise 141 per cent in June 2021,2021-07-01
Honda starts deliveries for CB650R and CBR650R,2021-07-01
Skoda announces new corporate strategy,2021-07-01
"Prevail Electric unveils Elite, Finesse, Wolfury electric scooters",2021-06-30
"TVS iQube Electric scooter launched in Pune, here are all the details",2021-06-30
Bajaj Chetak electric scooter deliveries expected to restart in July-September quarter,2021-06-30
Tata Motors to supply 15 hydrogen-based fuel cell buses to Indian Oil Corporation,2021-06-30
"Hyundai rolls out 10 millionth car from its Chennai plant, Alcazar gets the honour",2021-06-30
Asia's longest high-speed test track opens in Pithampur,2021-06-30
Hyundai Alcazar: Technical specifications explained,2021-06-30
Goodyear India introduces Covid-19 support measures for employees,2021-06-30
"Mahindra XUV500 has total offers of up to Rs 1,89,700, here are the details",2021-06-30
Mahindra Bolero offers: Get all the details here,2021-06-30
"Hyundai Showroom Live facilitates 50,000+ contactless sales consultations",2021-06-29
"Skoda Kodiaq facelift receives cosmetic updates, added features",2021-06-29
Honda's first-ever electric SUV is coming in 2024,2021-06-29
Audi e-tron electric SUV India launch details revealed,2021-06-29
Nissan pays homage to a legend,2021-06-29
Hyundai Creta SX Executive launched in India at Rs 13.18 lakh,2021-06-28
Skoda Kushaq Active: Check out what the base variant has in store for you,2021-06-28
2022 Honda Civic hatchback breaks cover,2021-06-28
Skoda Kushaq in pics: Hyundai Creta and Kia Seltos-rival doesn't fail to impress,2021-06-28
Skoda Kushaq vs Hyundai Creta vs Kia Seltos vs Renault Duster: Price comparison,2021-06-28
"Hyundai Alcazar review, first drive",2021-06-27
"Skoda Kushaq launch in India on June 28, deliveries of Hyundai Creta-rival to start on July 12",2021-06-25
Citroen-Eccentric Engine collaboration: Over 2.50 lakh visitors explore C5 Aircross SUV via 3D configurator,2021-06-25
Hennessey's Mammoth 1000 TRX is the fastest and most powerful pickup truck,2021-06-25
CEAT SecuraDrive SUV tyre range launched for compact SUVs,2021-06-25
BMW Art Cars part 3,2021-06-24
Porsche to produce high-performance battery cells,2021-06-24
Polestar 3 electric SUV to be manufactured in the USA,2021-06-24
"New Ferrari 296 GTB debuts with 819bhp, V6 hybrid powertrain",2021-06-24
Renault Kiger showcased in 233 towns across 13 states in 3 months via Rural Float mobile showroom initiative,2021-06-24
"Hyundai Alcazar accessory packs revealed, get complete details here",2021-06-24
GM to boost EV investments by $35 billion through 2025,2021-06-24
Volkswagen to use new 3D printing process in future vehicle production,2021-06-24
"Harley-Davidson to reveal new 1,250cc motorcycle on July 13",2021-06-23
"New Hyundai Alcazar garners over 4,000 bookings",2021-06-23
"Tata Safari, Nexon, Altroz, others: Automaker ties up with Kotak Mahindra Prime to offer PV finance options",2021-06-23
Toyota joins hands with ACMA for training auto component manufacturers,2021-06-23
Royal Enfield rolls out TimelessClassic campaign to celebrate Classic 350's legacy,2021-06-23
"Yamaha FZ-X accessory list revealed, price starts at Rs 300",2021-06-23
"Hero Splendor+, HF Deluxe, Passion Pro, Pleasure+, others: Company to hike bike, scooter prices from July 1",2021-06-22
Gujarat Electric Vehicle Policy 2021: State govt to provide subsidies of up to Rs 1.50 lakh on EVs,2021-06-22
Yamaha FZ-X: 5 important details you should know,2021-06-22
Skoda Kushaq vs Hyundai Creta vs Kia Seltos: Technical specifications compared,2021-06-22
New Jaguar F-Pace SVR bookings open in India,2021-06-21
"Nissan India exports over 1,200 units of Magnite to Nepal, Indonesia, South Africa",2021-06-21
MG Motor India reintroduces 'MG CARE at Home' to offer doorstep contactless car services,2021-06-21
Hyundai Alcazar variant-wise prices explained,2021-06-21
"Bugatti Type 59, one of the most beautiful racing cars",2021-06-19
Honda Motorcycle & Scooter India opens new BigWing dealership in Delhi,2021-06-18
"CARS24 commences operations in Australia, UAE",2021-06-18
Jaguar I-PACE completes Everesting Challenge,2021-06-18
"2021 Hyundai Alcazar vs Tata Safari vs MG Hector Plus vs Mahindra XUV500 - Price, specifications comparison",2021-06-18
Yamaha Fascino 125 Fi unveiled,2021-06-18
"Hyundai Alcazar vs Hyundai Creta - Price, technical specifications compared",2021-06-18
"Hyundai Alcazar launch in India today, here are all the important details",2021-06-18
"DL, RC, other vehicle documents' validity extended till September 30",2021-06-17
Discovering Orchha ft. Hyundai Grand i10 Nios Turbo - Magnificent India,2021-06-17
MoRTH notifies new central PUC rules: Everything you need to know,2021-06-17
Volkswagen India expects pre-owned car market to thrive by 2025,2021-06-17
Revolt RV400 price dropped and bookings to start soon,2021-06-17
Hyundai Alcazar starts reaching dealerships ahead of launch in India,2021-06-17
"Yamaha FZ-X launch in India tommorrow: Expected price, specs and features!",2021-06-17
"Top-selling compact sedans in May 2021: Maruti Suzuki Dzire leads; Hyundai Aura, Honda Amaze, Tata Tigor follow",2021-06-16
Toyota customers can now get vehicle parts delivered at home,2021-06-16
All-electric Rimac Nevera pushes the hypercar envelope,2021-06-16
"Hyundai Alcazar mileage, dimensions leaked ahead of launch",2021-06-16
Maserati Grecale crossover spotted ahead of debut later this year,2021-06-16
Jaguar Land Rover working on a Hydrogen Fuel Cell Defender,2021-06-16
Skoda Kushaq India launch details revealed,2021-06-16
"2022 Lexus NX debuts with exterior update, new infotainment system and hybrid powertrain",2021-06-16
"Okinawa slashes prices of its electric scooters by up to Rs 17,892",2021-06-16
"Hyundai i20, Grand i10 Nios, Aura, Santro, Kona EV: Offers up to Rs 1.50 lakh in June 2021",2021-06-16
SsangYong Korando e-motion based on Mahindra's MESMA unveiled,2021-06-16
"Delhi announces Rs 10,000 fine for old petrol, diesel cars",2021-06-16
"Hyundai Alcazar colour options revealed, check them out here",2021-06-15
BMW Art Cars part 2,2021-06-15
TVS iQube Electric price slashed after FAME II subsidy revision,2021-06-15
"Tata Motors bags order of 115 ambulances from Gujarat government, supplies first 25 vehicles",2021-06-15
Volkswagen Taigo spied sans camouflage,2021-06-15
Toyota restarts operations at Bidadi plants,2021-06-15
"Hyundai i20 has offers up to Rs 15,000 in June 2021, get all the details here",2021-06-15
A special Rolls-Royce comes in for service!,2021-06-15
"Top 5 selling premium hatchbacks in May 2021: Baleno at numero uno position; i20, Altroz, others follow",2021-06-15
Maruti Suzuki Celerio to look like this,2021-06-15
Skoda's Electric Vehicle roadmap: Two new Skoda EVs incoming!,2021-06-15
Piaggio One full details revealed,2021-06-15
Hyundai Creta crosses sales milestone of 6 lakh units in India,2021-06-15
"Hyundai Alacazar variants revealed, here are all the details",2021-06-14
"Top 5 selling compact SUVs in May 2021: Kia Sonet at top, Tata Nexon at second position, here is complete list",2021-06-14
Speed kills 3 in a bizarre Seltos split,2021-06-14
"TVS rolls out ""Rs 49 a day"" scheme for the XL100",2021-06-14
"2021 BMW S 1000 R launch in India tomorrow: Price, specs and features revealed",2021-06-14
Have you downloaded AUTO TODAY June 2021 issue yet?,2021-06-14
"Govt increases FAME II subsidy on electric two-wheelers, manufacturers welcome the move",2021-06-12
New Mercedes-Benz S-Class launch in India on June 17,2021-06-11
"Overall domestic vehicle sales at 4,42,013 units in May 2021: SIAM",2021-06-11
Pratap Bose to lead Mahindra's global design facility,2021-06-11
Delhi Traffic Police issues revised speed limits for motor vehicles | All you need to know,2021-06-11
A Lamborghini made from LEGO,2021-06-11
Toyota Land Cruiser LC300 unveiled,2021-06-11
Hyundai Alcazar seating options explained,2021-06-11
Citroen C5 Aircross SUV sales at 40 units in May 2021,2021-06-10
"2021 Skoda Octavia vs Hyundai Elantra: Price, technical specifications compared",2021-06-10
CARS24 launches new initiative to allow customers to buy used car online,2021-06-10
Yamaha FZ-X bookings open,2021-06-10
Tata Nexon touches production milestone of 2 lakh units,2021-06-10
"Hyundai Alcazar launch in India on June 18, check out all details here",2021-06-10
"Top 5 selling mid-size sedans in May 2021: Verna moves ahead of City; Rapid, Ciaz, Vento follow",2021-06-09
"Renault Kwid, Triber, Kiger, Duster: Check out all offers in June 2021",2021-06-09
"2021 Skoda Octavia variants, features, specifications, other important details revealed",2021-06-09
Hyundai Alcazar: Bookings open now,2021-06-09
Covid-19 pandemic: Royal Enfield donates Rs 2 crore to Tamil Nadu Chief Minister's Public Relief Fund,2021-06-08
"Zypp Electric forays into South India, launches services in Hyderabad",2021-06-08
Tata Motors to discontinue 4 Nexon diesel variants,2021-06-08
"Hyundai delivers high-flow nasal oxygen machines, BiPAP machines, ventilators to Delhi government",2021-06-08
Endeavour vs Fortuner vs Gloster vs Alturas G4: Some surprises in May 2021 sales,2021-06-08
New Kia Sportage revealed,2021-06-08
"Mahindra Scorpio has total offers of up to Rs 36,042 in June 2021, get all details here",2021-06-07
Covid-19 pandemic: MG dealer employees to get free medical insurance,2021-06-07
"Nissan India joins hands with Orix, launches new subscription plan for Magnite, Kicks, Redi-Go",2021-06-07
2021 Ducati Panigale V4 BS6 launched in India at Rs 23.50 lakh,2021-06-07
"Skoda Kushaq production starts in India, launch by June-end",2021-06-07
"Covid-19 pandemic: Honda India Foundation opens isolation centres in Haryana, Rajasthan",2021-06-07
Honda CRF300L patents filed in India,2021-06-07
"Top 10 selling cars in May 2021: Creta, Swift, Sonet, Nexon, Dzire, Venue, Baleno, Seltos, Nios, Bolero",2021-06-07
World Environment Day 2021: Reimagining mobility to combat pollution for a sustainable ecosystem,2021-06-05
NHPC signs e-mobility agreement with CESL to lease 25 EVs,2021-06-04
New Skoda Octavia launch in India on June 10,2021-06-04
"Bajaj Auto clocks total 2-wheeler sales of 2,40,554 units in May 2021",2021-06-04
"Tesla Model 3 to arrive in India soon for testing, electric sedan might go on sale before 2021-end",2021-06-04
Mahindra announces special vehicle purchase schemes for customers,2021-06-04
Michelin unveils high-performance racing tyre with 46 per cent sustainable materials,2021-06-03
Kia India introduces Kia Digi-Connect application to offer video-based live sales consultation,2021-06-03
BMW India introduces contactless vehicle service program,2021-06-03
Volvo Car India announces expansion of Digital Technology Hub in Bangalore,2021-06-03
Nexzu Roadlark electric bicycle: The heavy duty one,2021-06-03
"Hero MotoCorp clocks total sales of 1,83,044 units in May 2021",2021-06-02
New 2022 BMW i4 eDrive40 details out,2021-06-02
"Honda Motorcycle & Scooter India posts total sales of 58,168 units in May 2021",2021-06-02
"Royal Enfield registers domestic sales of 20,073 units in May 2021",2021-06-02
Mercedes-Maybach GLS 600 4Matic India launch details revealed,2021-06-02
"Mahindra's overall auto sales at 17,447 units in May 2021",2021-06-02
Covid-19 pandemic: DICV offers relief measures for dealers,2021-06-02
"MG Motor India retails 1,016 units in May 2021",2021-06-02
Yamaha's FZ25 and FZS 25 are now the most affordable 250cc bikes in India!,2021-06-02
Mercedes-Benz India introduces new retail sales service for customers,2021-06-02
New 2022 BMW iX xDrive50 launched,2021-06-02
"Maruti Suzuki India's total sales at 46,555 units in May 2021",2021-06-01
"Kia clocks total sales of 11,050 units in May 2021, Sonet is top performer",2021-06-01
"Tata Motors' domestic PV sales at 15,181 units in May 2021",2021-06-01
"Honda Cars India registers domestic sales of 2,032 units in May 2021",2021-06-01
Toyota reports sales of 707 units in May 2021,2021-06-01
New Lego Speed Champions McLaren Elva,2021-06-01
Renault Tiber gets 4 stars in latest Global NCAP test,2021-06-01
"Hyundai posts domestic sales of 25,001 units in May 2021",2021-06-01
FASTag-based toll collection on Yamuna Expressway from June 15,2021-06-01
Skoda Kushaq price announcement by June end,2021-05-31
Maruti Suzuki Dzire vs Honda Amaze vs Hyundai Aura: New prices compared,2021-05-31
Igarashi Motors India resumes operations at Chennai plants,2021-05-31
"Hyundai Creta, Venue, Tucson, Kona EV form ALCAZAR name at Rann of Kutch",2021-05-31
Droom's Orange Book Value used-vehicle pricing engine crosses 500 million queries milestone,2021-05-31
Hyundai Aura turbo petrol – Real world fuel efficiency & performance tested,2021-05-31
Honda City vs Hyundai Verna vs Maruti Suzuki Ciaz: New prices compared,2021-05-31
Covid-19 lockdown: Sonalika extends warranty on tractors by two months,2021-05-31
Sony India announces new mobile ES Series for car audio,2021-05-31
Operations at Renault plant affected as some staff stay off work amid Covid fears,2021-05-31
"Tata Tiago, Nexon, Harrier, Tigor: Total offers up to Rs 65,000 right now",2021-05-31
Customized Z06 Corvette pays tribute to military veterans,2021-05-31
BMW X7 M50d 'Dark Shadow' Edition available online in India,2021-05-31
Fifth-gen Kia Sportage SUV teased ahead of unveil in July,2021-05-31
TVS Motor Company opens new showroom in Iraq,2021-05-31
"Mahindra Scorpio, Bolero, XUV300, XUV500, Alturas G4: Offers up to Rs 3.06 lakh right now",2021-05-30
BMW Art Cars part 1,2021-05-30
"Tata Motors model-wise PV sales in April 2021: Nexon, Tiago, Altroz perform well; Safari disappoints",2021-05-30
Confident of better performance in India this year: Mercedes-Benz,2021-05-30
Suzuki Motorcycle India looks to boost exports to developed markets,2021-05-30
"Mahindra model-wise sales in April 2021: Bolero at top; XUV300, Scorpio, Thar follow",2021-05-30
2021 Mercedes-Benz GLA vs BMW X1 vs Volvo XC40: Prices compared,2021-05-29
Cyclone Yaas: Hyundai forms Relief Task Force to support affected customers,2021-05-29
Honda Motorcycle & Scooter India resumes production at its plants in phased manner,2021-05-29
Hyundai Creta 1.4 turbo petrol automatic – Real world fuel efficiency & performance tested,2021-05-29
JK CARES package announced to support dependent families of employees succumbing to Covid-19,2021-05-28
Maruti Suzuki Wagon R Electric spotted: all details inside,2021-05-28
